Barcode	Author	Title	Description	Keywords	Publisher	Date	Status	TimesLent	ISBN	Value	BindingPages
101622	Humprey Caroline. 	Sacred Architecture	Makers of the revolution in Biologyodels of the cosmos, symbolic form & ornament, traditions of Easr & West	Architecture	Little Brown & Company	1997	Lending		1-900131-70-6		
106561	Humphry, Derek	Jesus Never Existed		Religion		2005	Lending				
101624	Hunt, Edmund John	Rise and Destiny of Man, The		Anthropology	Watts & Co.	1909	Reference				P/54
104591	Hunter, Julie	The myths that make us	How myths have influenced western civilsation & culture	Mythology	Hazard Press	2006	Lending		1-877393-13-4		
104958	Huntingdon, Samual P.	Clash of Civilizations and the Remaking of World Order, The		Politics	Touchstone	1997	Lending		0-684-84441-9	$24.95	P/367
103253	Hurst, John F	History of Rationalism		Rationalism	Scribner Armstrong	1865	Reference				H/623
101625	Hurst, John F	History of Rationalism		Rationalism	Trubner & Co	1867	Reference				H/525
101626	Hurst, Rona	Loom of Life, The		Biology	Pemberton Publishing	1964	Reference				H/197
101627	Hutcheon, Pat Duffy	Road to Reason, The		Humanism	Canadian Humanist Publications	2001	Lending		0-9686014-1-3	$US 14.00	P/180
103205	Hutcheon, Pat Duffy	Road to Reason, The		Humanism	Canadian Humanist Publications	2001	Lending		0-9686014-1-3	$US 14.00	P/180
102256	Hutchins Robert	Great Ideas Today The				1963	Lending				
101628	Hutchins, Robert M.	Great books of the western world: 5. Aeschylus, Sophocles, Euripides, Aristophanes		Philosophy	William Benton	1952	Lending		0-85229-163-9		
106217	Hutchison, John A	Paths of Faith		Comparative Religion	McGraw-Hill	1991	Lending		0-07-031543-4	$22.00	H/629
104147	Hutton, Edward	Rome		Ancient History	Methuen	1922	Reference				H/342
101629	Hutton, Edward	Stations of the Sun The	History of the Ritual year in Britain	History		1996	Lending				
101631	Huxley, Aldous	Do What You Will		Humanism	Watts & Co	1936	Lending				H/246
104590	Huxley, Aldous	Do What You Will		Humanism	Watts & Co	1936	Reference				H/246
101630	Huxley, Aldous	Perennial Philosophy, The		Philosophy / Theology	Fontana	1958	Lending				P/319
103254	Huxley, Aldous	Proper Studies		Humanism	Chatto & Windus	1927	Reference				H/299
101633	Huxley, Aldous	Science, Liberty & Peace		Sociology	Chatto & Windus	1950	Reference				H/63
101634	Huxley, Aldous (ed)	Encyclopedia of Pacifism, An		Pacifism	Chatto & Windus	1937	Reference				P/126
101632	Huxley, Aldous	The Perennial philosophy		Philosophy	Triad Grafton	1985	Lending		0-586-06496-6		
104974	Huxley Aldous 	Brave New World	satiric vision of a utopian future	Science Fiction	Harper Collins	1932	Lending		q		
106444	Huxley Julian	Destiny of Man The				1959	Lending				
101635	Huxley, Julian	Essays in Popular Science		Science	Penguin	1937	Lending				P/256
104586	Huxley, Julian	Essays in Popular Science		Science	Chatto & Windus	1926	Reference				H/307
101636	Huxley, Julian	Essays of a Humanist		Humanism	Chatto & Windus	1964	Lending				H/288
101638	Huxley, Julian	Essays of a Humanist		Humanism	Chatto & Windus	1964	Lending				H/288
101637	Huxley Julian	Essays of a Humanist		Humanism	Chatto & Windus	1964	Lending				
103255	Huxley Julian	Essays of a Biologist		Biology		1923	Reference				
104587	Huxley, Julian	Evolution in Action		Evolution	Chatoo & Windus	1953	Reference				H/159
104589	Huxley, Julian	Evolution: The Modern Synthesis		Evolution	George Allen & Unwin	1945	Reference				H/645
101639	Huxley, Julian	Evolutionary Humanism		Biology	Prometheus Books	1992	Lending		0-87975-778-7		P/288
101640	Huxley, Julian	Individual in the Animal Kingdom, The		Biology	Cambridge University Press	1912	Reference				H/165
101642	Huxley, Julian	Memories		Biography	George Allen & Unwin	1970	Lending				H/296
101645	Huxley, Julian	Memories II		Autobiography / Huxley, Julian	Penguin Books	1973	Lending				P/256
103256	Huxley, Julian	Memories II		Biography	George Allen & Unwin	1970	Lending				H/269
101646	Huxley, Julian	New Bottles for New Wine		Essays	Chatto & Windus	1959	Lending				H/318
103204	Huxley, Julian	On Living in a Revolution		Humanism	Chatto & Windus	1944	Lending				H/195
101643	Huxley, Julian	On Living in a Revolution		Humanism	Chatto & Windus	1944	Reference				H/195
101644	Huxley, Julian	Religion Without Revelation		Religion	Max Parrish	1959	Lending				H/252
101648	Huxley, Julian	Religion Without Revelation		Religion	Watts & Co.	1940	Reference				H/113
101647	Huxley, Julian	Science, Religion and Human Nature		Science / Religion	Watts & Co.	1930	Reference				H/80
101660	Huxley, Julian	ScientificResearch and Social Needs		Science / Politics	Watts & Co.	1934	Reference				H/287
101649	Huxley, Julian	Soviet Genetics and Modern Science		Biology / Soviet	Watts & Co.	1949	Reference				H/244
103257	Huxley, Julian	Stream of Life, The		Evolution	Watts & Co	1926	Lending				H/56
101651	Huxley, Julian	Stream of Life, The		Evolution	Watts & Co	1926	Reference				H/56
101650	Huxley, Julian	What Dare I Think?		Science / Humanism	Chatto & Windus	1931	Reference				H/270
101652	Huxley, Julian (ed)	Humanist Frame, The		Humanism	George, Allen & Unwin	1965	Lending				H/432
101641	Huxley, Julian (Ed.)	Humanist Frame, The		Humanism	George Allen & Unwin	1962	Lending				H/432
103258	Huxley, Julian, Darwin, et.al.	Destiny of Man, The		Essays	Hodder & Stoughton	1959	Lending				P/92
101653	Huxley, Leonard	Progress and the Unfit		Eugenics	Watts & Co	1926	Reference				H/52
101659	Huxley, Leonard	Thomas Henry Huxley: A Character Sketch		Biography	Watts & Co	1920	Lending				H/120
101662	Huxley, Leonard	Thomas Henry Huxley: A Character Sketch		Biography	Watts & Co	1920	Reference				H/120
101661	Huxley, Leonard (ed)	Life and Letters of Thomas Henry Huxley, Vol 1/3	 Early life	Huxley	Macmillan London	1908	Reference				H/463
101663	Huxley, Leonard (ed)	Life and Letters of Thomas Henry Huxley, Vol 2/2	paleontology and evolution	Huxley	Macmillan London	1900	Reference				H/504
101658	Huxley, Leonard (ed)	Life and Letters of Thomas Henry Huxley, Vol 2/3	The imperial institute	Huxley	Macmillan London	1908	Reference				H/476
101664	Huxley, Leonard (ed)	Life and Letters of Thomas Henry Huxley, Vol 3/3		Huxley	Macmillan London	1908	Reference				H/501
101665	Huxley, Thomas Henry	American Addresses		Biology	MacMillan and Co	1877	Reference				H/164
101666	Huxley, Thomas Henry	Darwiniana  2		Darwin	MacMillan and Co	1907	Reference				H/475
101667	Huxley, Thomas Henry	Discourses Biological and Geological  2		Biology / Geology	MacMillan and Co	1908	Reference				H/368
101668	Huxley, Thomas Henry	Essays Upon Some Controverted Questions 2		Essays	MacMillan and Co	1892	Reference				H/625
101669	Huxley, Thomas Henry	Evolution and Ethics and Other Essays		Evolution / Ethics	MacMillan and Co	1894	Lending	2			H/334
101671	Huxley, Thomas Henry	Evolution and Ethics and Other Essays		Evolution / Ethics	MacMillan and Co	1894	Reference				H/334
101670	Huxley, Thomas Henry	Hume with Helps to the Study of Berkeley		Philosophy	MacMillan and Co	1908	Lending				H/319
101673	Huxley, Thomas Henry	Hume with Helps to the Study of Berkeley		Philosophy	MacMillan and Co	1908	Reference				H/319
101672	Huxley, Thomas Henry	Lectures and Essays		Essays	MacMillan and Co	1904	Lending	1			H/119
101674	Huxley, Thomas Henry	Lectures and Essays		Essays	Watts & Co	1931	Reference				H/232
101675	Huxley, Thomas Henry	Man's Place in Nature		Sociobiology	MacMillan and Co	1906	Lending				H/328
101677	Huxley, Thomas Henry	Man's Place in Nature		Sociobiology	MacMillan and Co	1906	Reference				H/328
101676	Huxley, Thomas Henry	Method and Results		Science / Essays	MacMillan and Co	1904	Reference				H/430
101678	Huxley, Thomas Henry	Science and Christian Tradition		Science / Christianity	MacMillan and Co	1909	Reference				H/419
101679	Huxley, Thomas Henry	Science and Education		Science / Education	MacMillan and Co	1893	Lending				H/451
101680	Huxley, Thomas Henry	Science and Education		Science / Education	MacMillan and Co	1910	Reference				H/451
101681	Huxley, Thomas Henry	Science and Hebrew Tradition		Science / Judaism	MacMillan and Co	1893	Lending				H/372
101683	Huxley, Thomas Henry	Science and Hebrew Tradition     2		Science / Judaism	MacMillan and Co	1904	Reference				H/372
101682	Hyams, Edward	Soil and Civilisation		Anthropology	Thames & Hudson	1952	Reference				H/312
101684	Hyde, H Montgomery	Norman Birkett: The Life of Lord Birkett of Ulverston		Biography	Reprint Society	1965	Lending				H/638
101686	Hyde, Lawrence	Isis and Osiris		Humanism	Rider & Co	1946	Reference				H/231
101687	Hyde, Vicki	Godzone Skies: Astronomy for New Zealanders		Astronomy	Canterbury University Press	1992	Lending	2	0-908812-19-1		P/80
101689	Inge Rev.W.R.	Mysticisim In Religion		Etymoligy	Reat Britain St Albans						
104851	Inge, W. R. 	Christian ethics and modern problems		Religion	Hodder & Stoughton	1930	Lending				
106049	Ide, Arthur Frederick	Unzipped: The Popes Bare All		Catholicism	Watts & Co	1987	Lending	5	0-9103090-43-4		P/189
101688	Ingersoll, Robert G	Atheist Truth vs Religion's Ghosts		Atheism	AAP	1980	Lending	1			P/57
101714	Ingersoll, Robert G	Atheist Truth Vs. Religion's Ghosts		Freethought	AAP	1980	Lending		0-911826-03-9		P/57
103259	Ingersoll, Robert G	Complete Lectures		Freethought		1972	Reference				
101715	Ingersoll, Robert G	Freethought Miscellaneous Volume 1	Bradlaugh, Shelley, Hume & Foote	Freethought		1903	Reference				
104244	Ingersoll, Robert G	Ghosts and Other Lectures, The		Philosophy	C P Farrell	1878	Lending				H/232
104583	Ingersoll, Robert G	Ghosts and Other Lectures, The		Philosophy	C P Farrell	1881	Reference				H/232
101716	Ingersoll, Robert G	Gods: A Lecture, The		Christianity / Critique	C P Farrell	1899	Lending				P/90
101718	Ingersoll, Robert G	Gods: A Lecture, The		Christianity / Critique	C P Farrell	1899	Reference				P/90
101717	Ingersoll, Robert G	Ingersoll on Blasphemy		Blasphemy	C P Farrell	1888	Lending	1			H/84
101720	Ingersoll, Robert G	Ingersoll on Blasphemy		Blasphemy	C P Farrell	1888	Reference				H/84
101719	Ingersoll, Robert G	Ingersoll's 44 Lectures, Complete		Freethought	M A Donohue & Co	1899	Lending	1			H/411
101721	Ingersoll, Robert G	Ingersoll's 44 Lectures, Complete		Freethought	M A Donohue & Co	1899	Reference				H/411
101723	Ingersoll, Robert G	Ingersoll's Greatest Lectures		Freethought	Freethought Press Association	1944	Lending				H
101722	Ingersoll, Robert G	Lectures and Essays		Humanism	Watts & Co	1945	Lending				H
101725	Ingersoll, Robert G	Lectures and Essays		Humanism	Watts & Co	1926	Reference				H
101724	Ingersoll, Robert G	Lectures and Essays		Humanism	Watts & Co	1956	Lending				
101726	Ingersoll, Robert G	Letters of Robert G Ingersoll, The		Letters	Philosophical Library	1951	Lending	1			H/747
104212	Ingersoll, Robert G	Liberty of Man and Other Essays, The		Humanism	Watts & Co	1949	Reference				H/114
101729	Ingersoll, Robert G	Life and Letters of Robert G Ingersoll, The		Letters	Watts & Co	1952	Lending				H/309
101728	Ingersoll, Robert G	Life and Letters of Robert G Ingersoll, The		Letters	Watts & Co	1952	Reference				H/309
101727	Ingersoll, Robert G	Mistakes of Moses				1904	Reference				
101731	Ingersoll, Robert G	Rome or Reason? A Reply to Cardinal Manning		Catholicism	Pioneer Press	1899	Lending				P/59
104582	Ingersoll, Robert G	Rome or Reason? A Reply to Cardinal Manning		Catholicism	Pioneer Press	1899	Reference				P/59
101730	Ingersoll, Robert G	Some Reasons Why I Am A Freethinker		Freethought	AAP	1983	Lending		0-911826-67-9		P/38
103260	Ingersoll, Robert G	What is Religion : Ingersolls Last Public Address”	at the Boston Theatre June 2cnd 1889				Reference				
101690	Ingersoll, Robert G	Works of Robert G Ingersoll, Vol 1	Lectures Religion & Society	Freethought	Dresden Publishing	1909	Reference				H/525
104738	Ingersoll, Robert G	Works of Robert G Ingersoll, Vol 1	Lectures Religion & Society	Freethought	Ingersoll League	1929	Reference				H/525
101702	Ingersoll, Robert G	Works of Robert G Ingersoll, Vol 10	Lectures Religion & Society	Freethought	Ingersoll League	1929	Reference				H/602
101711	Ingersoll, Robert G	Works of Robert G Ingersoll, Vol 10: 	Legal	Freethought	Dresden Publishing	1909	Reference				H/602
101699	Ingersoll, Robert G	Works of Robert G Ingersoll, Vol 11	Miscellany	Freethought	Ingersoll League	1929	Reference				H/607
101712	Ingersoll, Robert G	Works of Robert G Ingersoll, Vol 11: Miscellany	Makers of the revolution in Biology	Freethought	Dresden Publishing	1909	Reference				H/607
101700	Ingersoll, Robert G	Works of Robert G Ingersoll, Vol 1		Freethought	Ingersoll League	1929	Reference				H/637
101713	Ingersoll, Robert G	Works of Robert G Ingersoll, Vol 1		Freethought	Dresden Publishing	1909	Reference				H/637
101701	Ingersoll, Robert G	Works of Robert G Ingersoll, Vol 2: Lectures		Freethought	Dresden Publishing	1909	Reference				H/491
101691	Ingersoll, Robert G	Works of Robert G Ingersoll, Vol 2: Lectures		Freethought	Ingersoll League	1929	Reference				H/491
101703	Ingersoll, Robert G	Works of Robert G Ingersoll, Vol 3: Lectures		Freethought	Dresden Publishing	1909	Reference				H/521
101692	Ingersoll, Robert G	Works of Robert G Ingersoll, Vol 3: Lectures		Freethought	Ingersoll League	1929	Reference				H/519
101704	Ingersoll, Robert G	Works of Robert G Ingersoll, Vol 4: Lectures		Freethought	Ingersoll League	1929	Reference				H/508
101705	Ingersoll, Robert G	Works of Robert G Ingersoll, Vol 4: Lectures		Freethought	Dresden Publishing	1909	Reference				H/508
101693	Ingersoll, Robert G	Works of Robert G Ingersoll, Vol 5: Discussions		Freethought	Ingersoll League	1929	Reference				H/524
101706	Ingersoll, Robert G	Works of Robert G Ingersoll, Vol 5: Discussions		Freethought	Dresden Publishing	1909	Reference				H/524
101694	Ingersoll, Robert G	Works of Robert G Ingersoll, Vol 6: Discussions		Freethought	Dresden Publishing	1909	Reference				H/513
101695	Ingersoll, Robert G	Works of Robert G Ingersoll, Vol 6: Discussions		Freethought	Ingersoll League	1929	Reference				H/513
101707	Ingersoll, Robert G	Works of Robert G Ingersoll, Vol 7: Discussions		Freethought	Dresden Publishing	1909	Reference				H/572
101696	Ingersoll, Robert G	Works of Robert G Ingersoll, Vol 7: Discussions		Freethought	Ingersoll League	1929	Reference				H/572
101708	Ingersoll, Robert G	Works of Robert G Ingersoll, Vol 8: Interview		Freethought	Ingersoll League	1929	Reference				H/619
101709	Ingersoll, Robert G	Works of Robert G Ingersoll, Vol 8: Interviews		Freethought	Dresden Publishing	1909	Reference				H/619
101697	Ingersoll, Robert G	Works of Robert G Ingersoll, Vol 9: Political		Freethought	Ingersoll League	1929	Reference				H/582
101710	Ingersoll, Robert G	Works of Robert G Ingersoll, Vol 9: Political		Freethought	Dresden Publishing	1909	Reference				H/582
106593	Ingersoll, Robert G	Works of Robert G Ingersoll, Vol 10: Legal		Freethought	The Ingersoll Publishing	1909	Reference				
106594	Ingersoll, Robert G	Works of Robert G Ingersoll, Vol 11: Miscellany									
101698	Ingersoll, Robert G	Lectures and Essays (A Selection)		Freethought	Watts & Co	1949	Lending				
104897	Inglis James	The Bible Cyclopedia: A complete classification of Scripture Texts in the form of an alphabetical list of subjects		Theology	London	1799	Reference				
104879	Ingram, Kenneth	Modern Thought on Trial		Philosophy	Phillip Allan	1933	Reference				H/245
101733	Illes, Judika	The Element Encyclopedia of Witch Craft		Witch Craft	Harper Element	2005	Lending		978-0-00-719293-9		
106023	Illingworth Valerie	Dictionary of Physics		Physics		1977	Lending				
101734	Inman, Thomas	Ancient Pagan and Modern Christian Symbolism		Symbolism	Peter Eckler	1921	Reference				H/147
104584	International Bible Society	God's Word	Containing the old testament and the new testament	Bible	International Bible Society	1973	Lending				
106076	Irvine, G M	Churches, Religion and Progress		Humanism	Watts & Co	1920	Reference				H/197
101735	Isaacson Walter	Einstein		Science	Simon & Schuster	2007	Lending		978-0-7432-6473-0		
104841	Jackson, Ellen	Tree of Life, The		Evolution / Childrens	Prometheus Books	1993	Lending	3	0-87975-819-8		H/
101735	Jackson, H.R.	Churches & People in Australia and New Zealand 1860-1930		Sociology / new Zealand	Allen & Unwin	1987	Lending		0-86861-698-2		
106103	Jackson, H.R.	Churches & People in Australia and New Zealand 1860-1930		Sociology / new Zealand	Allen & Unwin	1987	Lending		0-86861-698-2		210/P
100907	Jackson, John G	Ages of Gold and Silver and Other short Sketches of Human History		History / Religion	AAP	1990	Lending	2	0-910309-90-6		P/331
101312	Jackson, John G	Christianity Before Christ		Christianity	AAP	1985	Lending	4	0-910309-20-5		P/238
101737	Jackson, John G	Christianity Before Christ		Christianity	AAP	1985	Reference	1	0-910309-20-5		P/238
101736	Jackson, John G.	Pagan Origins of the Christ Myth		Jesus	AAP	1988	Lending		0-910309-53-1		P/32
101738	Jacoby Susan	Freethinkers				2004	Lending				
101744	Jaki, Stanley L.	The Road of Science and the ways to God		Theology / Science	Scottish Academic Press	1978	Lending		7073-0228-5		
106158	James Montague Rhodes	Apocryphal New Testament	Gospel, lost heretical books	Theology / 	Oxford University Press	1924	Lending				
104807	James, William	Pragmatism and Other Essays		Philosophy	Washington Square Press	1963	Lending				P/313
103261	James, William	Talks to Teachers on Psychology: And to Students on Some of Life's Ideals		Psychology	Longmans Green	1929	Reference				H/301
101741	James, William	Varieties of Religious Experience, The		Psychology	Longmans Green	1920	Reference				H/534
101743	Jacoby Susan	Freethinkers				2004	Lending				
101744	James, William	Selected papers on philosophy		Philosophy	J. M. Dent & Sons	1947	Lending				
104937	Jardine Lisa	Worldly Goods	History of American Secularism	Freethinker		1996	Lending				
104581	Jaspers, Karl	Anaximander Heraclitus Parmenides Plotinus Lao-Tzu Nagarjuna	Edited by Hannah Arendt	Philosophy	Harvest/HBJ Book	1974	Lending		0-15-607500-8		
106193	Jaspers, Karl	Plato and Augustine		Philosophy	Harvest/HBJ Book	1962	Lending				
106181	Jaspers, Karl	Nietzsche & Christianity		Antichristianity	Henry Regnery Company	1961	Lending				
104941	Jayawardena, K & de Alwis, M	Embodied Violence: Communalising Women's Sexuality in South Asia		Women / Violence	Zed Press	1996	Lending		1-85649-447-0	$120	H/299
103262	Jeans, Sir James	Mysterious Universe, The		Cosmology	Cambridge University Press	1930	Lending				H/154
101750	Jeans, Sir James	Mysterious Universe, The		Cosmology	Cambridge University Press	1930	Reference				P/192
101745	Jefferson, Thomas	The Jefferson Bible, The life and morals of Jesus of Nazareth		Theology	Beacon Press	1989	Lending		978-0-8070-7714-6		
104996	Jennings William	Confucian Analects The		Philosophy			Reference				
102355	Jekyll, Walter	Bible Untrustworthy, The		Bible	Watts & Co	1905	Reference				H/284
104620	Jekyll, Walter	Bible Untrustworthy, The		Bible	Watts & Co	1904	Reference				
101753	Jeremias, Joachim	Infant Baptism in the first four centuries	translated by david cairns	Theology	SCM Press  	1960	Lending				
104961	Jeremias, Joachim	Rediscovering the Parables		Jesus 	SCM Press  	1963	Lending				
106238	Jesse, F Tennyson	Act of God		Fiction	Watts & Co	1940	Lending				H/179
104669	Jesse, F Tennyson	Act of God		Fiction	Watts & Co	1940	Reference				H/179
101752	Jevons, F B	Idea of God in Early Religions, The		Religioun / Anthropology	Cambridge University Press	1911	Reference				H/170
101754	Joachim Kahl	Misery of Christianity, The		Religion		1971	Lending				
101755	Joachimsthaler, Anton	The last days of Hitler	Translated by Helmut Bogler	History/Politics	Brockhampton Press	1999	Lending		1-86019-902-X		
106037	Joad, C E M	Guide to Philosophy		Philosophy	Victor Gollancz	1948	Reference				H/592
104247	Joad, C E M	Liberty Today		Politics	Watts & Co	1934	Lending				H/216
101756	Joad, C E M	Liberty Today		Politics	Watts & Co	1938	Reference				H/221
101757	Joad, C E M	Liberty Today		Politics	Watts & Co	1934	Lending				
101758	Joad, C E M	Meaning of Life, The: As Shown in the Process of Evolution		Evolution / Philosophy	Watts & Co	1928	Reference				H/60
104246	Joad, C E M	Philosophy for Our Time		Philosophy	Thomas Nelson and Sons	1943	Lending				H/367
101760	Joad, C E M	Philosophy for Our Time		Philosophy	Thomas Nelson and Sons	1946	Reference				H/367
101759	Jowett Benjamen	Theological Essays		Theology / 	Oxford  Horace Hart Printer to the University	1906	Reference				
104787	Johanson, Donald & Edey, Maitland	Lucy: The Beginnings of Humankind		Anthropology	Penguin Books	1990	Lending	2	0-14-013935-4		P/413
101763	Johnson, B C	Atheist Debater's Handbook, The		Atheism	Prometheus Books	1983	Lending	7	0-87975-210-6		P/134
101764	Johnson Dr Samuel	Dr Johnson's Dictionary	                                                                                                                                                    	Etymology Sociology	Penguin Press	2005	Lending		0-713-99887-3		
104803	Johnson, Christopher Jay and McGee, Marsha G. (Eds.)	How Different Religions View Death and Afterlife		Religion / Afterlife	The Charles Press Publishers	1991	Lending		0-914783-55-6	$15.00	P/354
106635	Johnson Chris	A better life	100 atheist speak on joy and meaning	Atheist	Printed in South Korea	2013	Reference		10 0989936007		
103263	Johnson, Sonja	From Housewife to Heretic		Mormonism	Doubleday & Co	1981	Lending		0-385-17493-4		H/406
101765	Johnson H James	Superior Men	Book of Reason	Rationalism		1949	Lending				
101770	Johnson, Roger	Rudolf Bultmann: Interpreting Faith for the modern era		Theology	Collins	1987	Lending		0-00-599977-4		
104923	Johnston, H, et al.	Generation of Religious Progress, A		Religion	Watts & Co	1916	Lending				H/151
104248	Johnston, H, et al.	Generation of Religious Progress, A		Religion	Watts & Co	1916	Reference				H/151
101769	Johnston, R F	Letters to A Missionary		Missionaries	Watts & Co	1918	Reference				H/158
101771	Johanson D. & J Shreeve	Luc's Child	The Discovery of a human ancestor	Anthropology		1989	Lending				
100977	Johnas, Hans	The Gnostic Religion	The Message of the alien God and the beginnings of christianity	Gnosticism	Beacon Press	1958	Lending		0-8070-5801-7		
106017	Jones, Lloyd	Life, Times and Labours of Robert Owen, The		Biography	Swan Sonnenschein	1900	Reference				H/443
104670	Jones, Steve	Almost Like a Whale : The Origin of Species Updated		Biology	Anchor	1999	Lending	2	1-862-30025-9	$29:95	P/499
102636	Jones, Steve	In the Blood: God, Genes and Destiny		Biology	Harper Collins	1996	Lending		0-00-255511-5		
106541	Josephus [edt. Thackery, H]	Josephus		Ancient History	Washington Square Press	1965	Lending				P/347
100655	Josephus [trans. Williamson, G]	Jewish War, The		Ancient History	Penguin Books	1981	Lending				P/511
101777	Josephus {trans. Williamson, G	Jewish War, The		Acient History	Pen Books	1959	Lending				
101778	Joyce, D.	Jesus Scroll, The		Archaeology	Angus & Robertson, London	1973	Lending	1	0-207-95551-4		H/216
104245	Joyce, Peter	Black Cat in a Dark Room	The futile search for God								
101779	Judson F Horace	Eighth Day of Creation The	Makers of the revolution in Biology	Biology		1979	Lending				
104773	Judson F Horace	Faith of an Agnostic The		Agnostic		1902	Reference				
104621	Jung, C. G.	The integration of the personality	Translated by Stanley M. Dell	Psychology	Butler and Tanner Ltd.	1940	Reference				
104885	Jung, C. G.	Modern man in search of a soul	Translated by W.S. Dell and Cary F. Baynes	Psychology	Lund Humphries	1945	Reference				
101780	Jung, C. G.	Memories, Dreams, Reflections	Translated from the German by Richard and Clara Winston	Psychology	Fontana	1967	Lending				
104891	Jung, C. G.	Four Archetypes: Mother, Rebirth, Spirit, Trickster		Psychology	Ark Paperbacks	1986	Lending		0-7448-0034-X		
106545	Jungel, Eberhard	God as the mystery of the world 	One the foundation of the theology of the crucified one in the dispute between theism and atheism	Theology	William B. Eerdmans 	1983	Lending		0-8028-3586-4		
104951	Juridicus [Pseud: Fillimore, Millard]	Great Physician, The		Biblical Studies	Watts & Co	1924	Lending				H/247
104622	Juridicus [Pseud: Fillimore, Millard]	Great Physician, The		Biblical Studies	Watts & Co	1924	Reference				H/247
101781	Kaballah Centre N.Z	Zohar The	Historically significant book written in acient Aramaic text “ Zohar” Hebrew word meaning splendour	Religion	The Kaballah Centre New york	2010	Reference		13 978 1 57189 701 5		
101783	Jury, Paul	Journal of a Psychoanalyst Priest		Catholocism	Lyle Stuart, Inc	1965	Lending	3			H/158
104778	Kadison, Alexander	Through Agnostic Spectacles		Agnosticism	The Truth Seeker Co.	1919	Reference				H/108
101792	Kahl, Joachim	Misery of Christianity, The		Christianity / Critique	Penguin Books	1972	Lending	3			P/212
101793	Kahl, Joachim	Misery of Christianity, The		Christianity / Critique	Penguin Books	1972	Reference				P/212
101794	Kalogridis, Jeanne	Burning Times, The		Fiction	Harper Collins	2001	Lending	2	0-00-225992-3		P/385
102612	Kalthoff, Albert	Rise of Christianity, The		Christian History	Watts & Co.	1907	Lending				H/201
101796	Kalthoff, Albert	Rise of Christianity, The		Christian History	Watts & Co.	1907	Reference				H/201
101797	Kamen, Henry	Spanish Inquisition, The		Religious Violence	Weidenfeld & Nicolson	1965	Lending	5			H/339
101798	Kaplan, D. E, Marshall, A.	Cult at the End of the World, The		Cults	Arrow Books	1997	Lending	1	0-09-972851-6		P/310
103272	Kaplan, D. E, 	Dialogues of Plato		Philosophy		1951	Reference				
101800	Kaplin Robert	Nothing that is The	A natural history of zero	Math		1999	Lending				
104250	Kasser, R.; Meyer, M.; Wurst, G.	The Gospel of Judas	Second Edition	Christianity	National Geographic Society	2006	Lending		978-1-4262-0048-9		
104903	Kato, Genshi	 A Study of Shinto: The Religion of the Japanese Nation		Eastern Religion	Meiji Japan Society	1926	Reference				H/255
