Barcode	Author	Title	Description	Keywords	Publisher	Date	Status	TimesLent	ISBN	Value	BindingPages
101051	Dedijer, Vladimir	Yugoslav Auschwitz and the Vatican, The: The croation Massacre of the Serbs During World War II		World War II / Yugoslavia	Prometheus Books	1992	Lending	8	0-87975-752-3		H/445
101063	DeGregori, Thomas R.	Bountiful Harvest: Technology, Food Safety, and the Environment		Technology	Cato Institute	2002	Lending		1-930865-31-7	$32.95	P/262
102762	Dehaene, Stanislas	Number Sense, The: How the Mind Creates Mathematics		Psychology / Mathematics	Penguin Books	1999	Lending		0-14-026134-6	$9.00	P/274
103107	Delve, Ken	Nightfighter: The Battle for the Night Skies		World War II / Fighters	Cassell & Co.	1995	Lending		0-304-35445-7	$12.00	P/256
103108	Demant, V A	Religion and the Decline of Capitalism		Religion / Capitalism	Faber & Faber	1952	Reference				H/204
106621	Denkers V	Nieuwe				2018	Lending				
101065	Dendy, Arthur	Biological Foundations of Society, The		Sociobiology	Constable	1924	Reference				H/197
101065	Dendy, Arthur	Outlines of Evolutionary Biology		Evolution	Constable	1919	Reference				H/455
101066	Denis, Numa; De Coulanges, Fustel	The Ancient City: A study of the religion, laws, and institutions of Greece and Rome		History	The John Hopkins University Press	1980	Lending		0-8018-2304-8		
106239	Dennett, Daniel C.	Consciousness Explained		Philosophy / Psychology	Penguin Books	1993	Lending		0-14-012867-0	$8.80	P/511
101067	Dennett, Daniel C.	Darwin's Dangerous Idea: Evolution and the Meanings of Life		Evolution	Penguin	1995	Lending	3	0-14-016734-X	$26.95	P/586
103109	Dennett, Daniel C.	Darwin's Dangerous Idea: Evolution and the Meanings of Life		Evolution	Penguin	1995	Lending	3	0-14-016734-X	$26.95	P/586
103089	Dennett, Daniel C.	Fredom Evolves		Philosophy / Free Will	Viking	2003	Lending		0-670-03186-0		347
103088	Dennett, Daniel C.	Kinds of Minds		Philosophy / Psychology	Phoenix	1996	Lending		0-75380-043-8	$29.95	P/244
103111	Dennett, Daniel C.	Breaking the spell: Religion as a natural phenomenon		Psychology / Religion	Penguin	2006	Lending		0-713-99789-7		
106008	Denton, William	Is Darwin Right?		Evolution	Unknown (Watts?)	1880	Reference				H/191
101069	Descartes, Rene	Discourse on Method and the Meditations		Philosophy	Penguin Books	1968	Lending		0-14-044206-5	$6.60	P/187
103093	Desjardins, Michel R.	Sin in valentinianism		Sin	Scholars Press	1990	Lending		1-55540-224-0		
106353	Desmond, Adrian	Huxley: The Devil's Disciple		Biography	Michael Joseph Ltd.	1994	Lending	2	0-7181-3641-1		H/475
101080	Desmond, Adrian & Moore, James	Darwin		Biography / Darwin, Charles	Michael Joseph	1991	Lending		0-7181-3430-3	$20.00	P/807
103112	deutsher Issac	Age of Permanent Revolution The	a trotsky anthology	Politics		1964	Lending				
103113	Devine, T.M.	Scottish Nation, The: 1700-2000		History / Scotland	Penguin Books	2000	Lending		0-14-023004-1	$15.00	P/695
104199	Dewar, Davies & Haldane	Is Evolution A Myth?		Evolution / Debate	Watts & Co.	1949	Lending				P/92
101083	Dewar, Davies & Haldane	Is Evolution A Myth?		Evolution / Debate	Watts & Co.	1949	Reference				P/92
101082	Dewar & Shelton intro' A Lunn	Is Evolution Proved a debate		Evolution		1947	Lending				
101081	Dewey John	Reconstuction in philosophy		Philosophy		1950	Lending				
104144	Di San Lazzaro, G.	Klee		Art History	Thames and Hudson	1956	Lending				304/H
104196	Diamond, Jared	Guns, Germs and Steel		Anthropology	Vintage	1997	Lending	3	0-09-930278-0	$13.00	P/480
100163	Diamond, Jared	Guns, Germs and Steel		Anthropology	Vintage	1997	Reference		0-09-930278-0	$13.00	P/480
102440	Diamond, Jared	Rise and Fall of the Third Chimpanzee, The		Anthropology	Random House	1992	Lending	3	0-09-991380-1	$11.00	P/360
103088	Diamond, Jared	Rise and Fall of the Third Chimpanzee, The		Anthropology	Random House	1992	Lending	3	0-09-991380-1		P/360
101085	Diamond, Jared	Why is Sex Fun?: The Evolution of Human Sexuality		Sex	Wiedenfeld & Nicolson	1997	Lending	2			P/168
100379	Diamond, Malcolm L.	Contemporary Philosophy and Religious Thought : An Introduction to the Philosophy of Religion		Philosophy / Religion	McGraw Hill	1974	Lending		0-07-016720-6	$10	P/450
100918	Diamond, Sara	Spiritual Warfare: The Politics of the Christian Right		Politics / Christianity	South End Press	1989	Lending	4	0-89608-361-6		P/292
101086	Dickens, Charles	The letters of Charles Dickens 1833-1870		Biography	Macmillan and Co.	1893	Lending				
106294	Dickens, Charles	Bleak House		Fiction	Thomas Nelson & sons London		Lending				
106493	Dickens, Charles	Little Dorrit		Fiction	Thomas Nelson & sons London		Lending				
106494	Dickens, Charles	Pickwick Papers		Fiction	Thomas Nelson & sons London		Lending				
106489	Dickens, Charles	Dombey & Son		Fiction	Thomas Nelson & sons London		Lending				
106490	Dickens, Charles	Barnaby Rudge		Fiction	Thomas Nelson & sons London		Lending				
106492	Dickens, Charles	Hard Times and Christmas Books		Fiction	Thomas Nelson & sons London		Lending				
106491	Dineen, Dr Tana	Manufacturing Victims: What the Psychology Industry is Doing to People		Psychology / Malpractice	Robert Davies Multimedia Publishing	1998	Lending			$US16.99	P/335
100794	Dingwall, Eric John	Racial Pride and Prejudice		Anthropology	Rationalist Press Association	1946	Reference				H/246
101087	Diprose & Bateman	Tacitus & Bracciolini				1878	Reference				
101088	Dinsmore, Charles Allen	Life of Dante Alighieri		Biography	Constable	1918	Reference				H/306
102900	Dixon, Bernard (Ed)	Journeys in Belief		Religion / Essays	Allen & Unwin	1968	Lending	1			H/239
101089	Dixon, Dougal	After Man: a Zoology of the Future		Evolution / Future	Book Club Association	1981	Lending				H/124
101090	Dixon-Kennedy, Mike	Native American Myth and Legend: An A-Z of people and places		Mythology	Blandford	1996	Lending		0-7137-2623-7		
104902	Doane, T.W.	Bible Myths and Their Parallels in Other Religions		Bible / Religion	Truth Seeker Company	1948	Reference				H/589
101091	Doane, T.W.	Bible Myths and Their Parallels in Other Religions		Bible / Religion	Truth Seeker Company	1948	Reference				H/589
101092	Dobzhansky 	Genetics the Origin of the Species		Genetics		1937	Lending				
103114	Dodds, E.R.	Greeks and the Irrational, The		Ancient History / Greece	University of California Press	1951	Lending		0-520-00327-6	$13.00	P/327
104192	Doherty, Earl	Jesus Puzzle, The		Jesus (Historicity)	Canadian Humanist Publications	2000	Lending			$US 14.50	P/380
102255	Dolan, Chester	Blind Faith: Confronting Contemporary Religion		Religion	Prometheus Books	1995	Lending	4	0-87975-931-3		H/357
101093	Dollison, John	Pope-Pourri		Catholicism / Papacy	Fireside, Simon & Schuster	1994	Lending	3	0-671-88615-0	US$14.00	P/206
102257	Dollison, John	Pope-Pourri		Catholicism / Papacy	Fireside, Simon & Schuster	1994	Reference		0-671-88615-0	US$14.00	P/206
102042	Donald, Graeme	The Dictionary of Modern Phrase		Language	Simon & Schuster	1994	Lending		0-671-71309-4		
106196	Donovan, Peter (ed.)	Religions of New Zealanders		Sociology / New Zealand	The Dunmore Press Ltd.	1990	Lending		0-86469-125-4		272/P
102043	Donovan, Peter (ed.)	Religions of New Zealanders		Religion/History		1990	Reference				
103120	Dorn, James et.al.	Revolution in Development Economics, The		Economics / Development	Cato Institute	1998	Lending		1-882577-56-6	$39.95	P/338
104193	Dorsey, George	Hows and Whys of Human Behaviour		Anthropology	Blue Ribbon Books	1929	Reference				H/298
101094	Dorsey, George	Why We Behave Like Human Beings		Anthropology	Blue Ribbon Books	1925	Lending				H/512
101096	Dorsey, George	Why We Behave Like Human Beings		Anthropology	Blue Ribbon Books	1925	Reference				H/512
101095	Dorward, Alan	Bertrand Russell		Biography	Longmans Green & Co.	1951	Reference				H/44
101097	Dos Passos, John	Living Thoughts of Tom Paine, The		Biography	Cassell	1940	Reference				H/178
101098	Dostoevsky, Feodor	Crime and punishment	Translated by Jessie Coulson	Literature	Hamlyn	1987	Lending		0-600-55161-X		
106419	Dougal, Sonia	Nun-Runners, The		Catholicism	Hodder & Stoughton	1971	Lending	1			H/192
101101	Douglas J. D.	New International Dictionary of the Christian Church The		Theology	Zondervin Publishing House 	1974	Lending		0-310-23830-7		
104792	Dove, C Clayton	Marcus Aurelius Antoninus: His Life and Times		Biography	Watts & Co.	1930	Reference				H/286
101103	Dowley, Tim	Eerdmans' handbook to the history of christianity		Christianity / History	WM. B. Eerdmans publishing Co.	1977	Lending		0-8028-3450-7		
106182	Downes, P.; Harcourt, P.;	Voices in the air	Radio broadcasting in New Zealand: A documentary	New Zealand 	Methuen & Co	1976	Lending				
106345	Downie, R Angus	James George Frazer: Portrait of a Scholar		Frazer	Watts & Co.	1940	Lending				H/141
101105	Downie, R Angus	James George Frazer: Portrait of a Scholar		Biography	Watts & Co.	1940	Reference				H/141
101104	Draper, John William	History of the Conflict Between Religion and Science		Religion / Science	The Pioneer Press	1923	Lending	1			H/373
101108	Draper, John William	History of the Conflict Between Religion and Science		Religion / Science	Kegan, Paul, Trench, & Co	1883	Reference				H/373
101106	Draper, John William	History of the Conflict Between Religion and Science		Religion / Science	Henry S. King & Co.	1883	Reference				H/373
101107	Draper, John William	History of the Intellectual Development of Europe Vol 1		History	George Bell London	1896	Reference				H/438
101110	Draper, John William	History of the Intellectual Development of Europe Vol 2		History	George Bell London	1896	Reference				H/438
101111	Draper, John William	History of the Intellectual Development of Europe, A. (Vol.1)		History / Europe	George Bell and Sons	1884	Reference				H/438
101109	Dresden, Sam	Humanism in the Renaissance		Humanism	World University Library	1968	Lending				P/255
101112	Drews, Arthur	Christ Myth, The		Christianity / Origins	T. Fisher Unwin	1910	Reference				H/304
101113	Drews, Arthur	Witnesses to the Historicity of Jesus, The		Jesus	Watts & Co.	1912	Reference				H/319
101114	Driessen, Paul	Eco-Imperialism: Green Power Black Death		Environmentalism / Critique	Free Enterprise Press	2003	Lending		0-939571-23-4		179/P
100015	Drinkwater, John	The Outline of Literature	Revised and Extended by Hugh Pollock and Campbell Nairne	Literature	Morrison and Gibb Ltd.	1942	Lending				
104878	Dudley, Sir Sheldon	Four Pillars of Wisdom, The		Humanism	Watts & Co.	1950	Reference				H/246
101116	Duff, Archibald	History of Old Testament Criticism		Biblical Studies	Watts & Co.	1910	Reference				H/152
101117	Duff, Charles	This Human Nature		Anthropology	Watts & Co.	1937	Lending				H/232
101119	Duff, Charles	This Human Nature		Anthropology	Watts & Co.	1950	Reference				H/298
101118	Dugan James	Man Explores the Sea				1960	Lending				
101121	Dujardin, Edouard	Ancient History of the God Jesus		Jesus	Watts & Co.	1938	Lending				H/172
104193	Dujardin, Edouard	Ancient history of the God Jesus		Christianity / Origins	Watts & Co.	1938	Reference				H/172
102546	Dujardin, Edouard	Ancient History of the God Jesus		Jesus	Watts & Co.	1938	Reference				H/172
101120	Dujardin, Edouard	Source of the Christian Tradition, The		Religious Anthropology	Watts & Co.	1911	Reference				H/307
101122	Dumont, Henry	Durer		Art History	The Uffici Press	196?	Lending				H/36
103084	Dunbar, Robin	Trouble with Science, The		Science	Faber and Faber	1995	Lending	1	0-571-17448-5		P/213
100370	Duncan, David	Life and Letters of Herbert Spencer, The		Herbert Spencer	Methuen & Co	1908	Reference				H/621
101123	Duncan, David	Life and Letters of Herbert Spencer, The		Herbert Spencer	Methuen & Co	1908	Reference				H/621
101124	Duncan, David	Heroes of Science: Botanists, zoologists and Geologists		Science	Society for Promoting Christian Knowledge	1882	Reference				
101125	Duncan, David E.	The Calendar: The 5000-year struggle to align the clock and the heavens – and what happened to the missing ten days		Science	Fourth Estate	1998	Lending		1-85702-721-3		
106247	Dunlap Knight	Religion : Its functions in Human Life		Religion		1946	Reference				
104107	Dunham Barrows	Man against Myth				1947	Lending				
101130	Dunn, Jane	Moon in Eclipse: A life of Mary Shelley		Biography	Weidenfeld & Nicolson	1978	Lending		0-297-77383-6		
106544	Dunn, Waldo Hilary & Richardson, Ivor L.	Sir Robert Stout: A Biography		Biography / Stout, Robert	A.H. & A.W. Reed	1961	Lending				H/224
104191	Dupuy, T.N.; Johnson, C.; Bongard, L.;	The Harper Encyclopedia of Military Biography		Military	Castle Books	1992	Lending		0-7858-0437-4		
106334	Durant, Will	The story of civilization (The Age of Faith)	A history of Medieval civilization – Christian, Islamic, and Judaic – from Constantine to Dante: A.D. 325 – 1300	History 	Simon & Schuster	1950	Reference				
106090	Durant, Will	The story of civilization: Part III (Caesar and Christ) 	A history of Roman civilization and of christianity from their beginnings to A.D. 325	History 	Simon & Schuster	1944	Reference				
106089	Durant, Will	The story of civilization: Part V (The Renaissance)	A history of civilization in Italy from 1304 – 1576 A.D.	History 	Simon & Schuster	1953	Reference				
106091	Durant, Will	The story of civilization: Part VI (The Reformation)	A history of European civilization from Wyclif to Calvin: 1300 -1564	History 	Simon & Schuster	1957	Reference				
106097	Durant, Will; Durant, Ariel	The story of civilization: Part VII (The age of reason begins)	A history of European civilization in the period of Shakespeare, Bacon, Montaigne, Rembrandt, Galileo, and Descartes: 1558-1648	History	Simon & Schuster	1961	Reference				
106100	Durant, Will; Durant, Ariel	The story of civilization: Part VIII (The Age of Louis XIV)	A history of European civilization in the period of Pascal, Moliere, Cromwell, Milton, Peter the Great, Newton, and Spinoza: 1648-1715	History	Simon & Schuster	1963	Reference				
106092	Durant, Will; Durant, Ariel	The story of civilization: Part IX (The age of voltaire)	A history of civilization in Western Europe from 1715 to 1756, with special emphasis on the conflict between religion and philosophy	History	Simon & Schuster	1965	Reference				
106099	Durant, Will; Durant, Ariel	The story of civilization: Part X (Rousseau and Revolution)	A history of civilization in France, England, and Germany from 1756, and in the Remainder of Europe from 1715, to 1789	History	Simon & Schuster	1967	Reference				
106098	Durant, Will	The Life of Greece	A history of Greek civilzation from the beginnings, and of civilzation in the Near East from the death of Alexander, to the Roman conquest.	History	Simon & Schuster	1939	Lending				
106085	Durant, Will	Our Oriental heritage	History of civilisation in Egypt and the Near East to the death of Alexander, and in India, China and Japan from the beginning to our own day	History	Simon & Schuster	1935	Lending				
106083	Durant, Will	Story of Philosophy, The		Philosophy / History	Ernest Benn Limited	1955	Lending				H/471
103118	Durant, Will	Story of Philosophy, The		Philosophy / History	Pocket Books	1953	Lending		0-671-73916-6		
106061	Durrani, Tehmina	My Feudal Lord		Biography	Bantam Press	1988	Lending			$14.30	H/320
101131	During Zoe	It's Been Mostly Fun	The memoir & musings of a maverick medic	Biography		2006	Lending				
101132	During Zoe	It's Been Mostly Fun	The memoir & musings of a maverick medic	Biography		2006	Reference				
104631	Dutt, Romesh	Ramayana and the Mahabharata, The		Hinduism	J.M. Dent & Sons.	1955	Reference				H/335
104632	Dworkin, Gerald (Ed.)	Determinism, Free Will, and Moral Responsibility		Philosophy	Prentice Hall Inc.	1970	Lending				P/217
103119	Dworkin, Ronald	Life's Dominion: An Argument About Abortion and Euthanasia		Ethics	Harper Collins	1993	Lending	1	0-00-686309-4		P/272
101133	Dyson, F W	Astronomy		Astronomy	J.M. Dent & Sons.	1912	Reference				H/118
101135	Dyson, Freeman J.	Infinite in All Directions		Science / Philosophy	Harper & Row	1988	Lending	2	0-06-039081-6		H/321
101136	Dyson, Freeman J.	The Sun, The Genome, and The Internet: Tools of Scientific Revolutions		Science History	Oxford University Press	1999	Lending		0-19-513922-4		P/124
102756	Eagleton, Terry	Illusions of Postmodernism, The		Postmodernism	Blackwell Publishers	1996	Lending		0-631-20323-0		P/147
100148	Earhart, H. Byron	Japanese Religion: Unity and Diversity		Religion / Japan	Wadsworth Publishing Company	1982	Lending		0-534-01028-8	$20.00	P/272
103126	Earles, Beverley M	Faith Dimension of Humanism Vol I		Humanism / Critique	Victoria University	1989	Reference				P/150
101137	Earles, Beverley M	Faith Dimension of Humanism Vol II		Humanism / Critique	Victoria University	1989	Reference				P/536
101138	Easterbrook, Gregg	Progress Paradox, The: How Life Gets Better While People Feel Worse	How life improves while people feel worse	Progress / Quality of Life	Random House	2003	Lending		0-679-46303-8	$47.95	376/H
	Easterman, Daniel	New Jerusalems : Reflections on Islam, Fundamentalism, and the Rushdie Affair		Islam	Grafton	1992	Lending	2	0-586-21672-3		P/240
101139	Ebbutt, M I	Hero Myths and Legends of the British Race		Mythology / England	George Harrap	1927 [1915	Lending	1			H/374
101141	Ebbutt, M I	Hero Myths and Legends of the British Race		Mythology / England	George Harrap	1915	Reference				H/374
101140	Ebeling, Richard M. [Ed.]	Disaster in Red: The Failure and Collapse of Socialism		Eocialism	The Foundation for Economic Education	1995	Lending		1-57246-003-2		379
101141		Dictionary of Science & Creationism		Creationism	Prometheus Books	1990	Lending	2	0-87975-549-0		H/263
106618	Eckhart,Meister ed Fleming, Ursula	The Man from whom God Hid Nothing	Christian spiritual guidance	Religion							
101142	Eco, Umberto	Name of the Rose, The		Fiction	Book Club Associates	1984	Lending	4			H/502
101143	Economist	The Economist Pocket Style Book		English Language	The Economist Publications Ltd	1987	Lending		0-85058-087-0	$14.00	H/96
103121	Edamaruku, S; Hoevels, F. E; Priskil, P.	Bhagwan Rajneesh and the Dilemma of his Religion		Cults	Freethought International	1993	Lending		81-7374-002-X		H/147
100652	Eddy, Mary Baker	Science and Health with Key to the Scriptures		Christian Science		2000	Lending		0-87952-259-3		P/700
102284	Edey Maitland & Johanson Donald C	Blueprints: Solving the Mystery of Evolution		Biology Evolution	Little, Brown & Company Canada	1989	Lending		0-316-21076-5		
103128	Edelman, Murray	Constructing the Political Spectacle		Media	University of Chicago Press	1988	Lending		0-226-18399-8	$29.95	P/137
103127	Edwards Chilperic	Old Testament The				1913	Reference				
103128	Edwards Chilperic	Vows				1958	Lending				
104628	Edwards Denis	Vows	Nuns & Priests speak out	Religion		1997	Lending				
104629	Edwards Harry	A Sceptics Guide to the New Age				2000	Lending				
104105	Edey, Maitland A & Johanson, Donald C.	Blueprints: Solving the Mystery of Evolution		Anthropology	Little, Brown, and Company	1989	Lending		0-316-21076-5	$17.60	H/418
104627	Edis, Taner	Ghost in the Universe, The: God in Light of Modern Science		Religion / Science	Prometheus Books	2002	Lending	2	1-57392-977-8	$51.95	H/326
102883	Edmonds, David & Eidinow, John	Wittgenstein's Poker: The Story of a Ten-Minute Argument Between Two Great Philosophers		Philosophy / History	Faber and Faber	2001	Lending		0-571-20547-X	$19.95	H/267
103129	Edwards, Chilperic [Pseud: Pilcher, Edward John]	Hammurabi Code, The		Ancient History	Watts & Co	1904	Reference				H/168
101145	Edwards, Chilperic [Pseud: Pilcher, Edward John]	Messianic Idea, The		Jesus	Watts & Co	1927	Reference				H/146
101144	Edwards, Chilperic [Pseud: Pilcher, Edward John]	World's Earliest Laws, The		Religious Anthropology	Watts & Co	1937	Reference				H/152
101146	Edwards, Paul	Reincarnation: A Critical Examination		Reincarnation	Prometheus Books	1996	Lending	2	1-57392-005-3		H/313
101148	Edwards, Paul & Papp, Arthur (Eds.)	Modern Introduction to Philosophy, A.		Philosophy	The Free Press	1967	Lending			$22.00	H/797
103130	Ehrlich R Paul	Race Bomb The				1977	Lending				
103122	Ehrman, Bart D.	Jesus: Apocalyptic Prophet of the New Millennium		Theology	Oxford University Press	1999	Lending		0-19-512473-1		
106236	Ehrman, Bart D.	The Orthodox corruption of scripture	The effect of early christological controversies on the text of the new testament	Theology	Oxford University Press	1993	Lending		978-0-19-510279-6		
106154	Ehrman Bart D  	Lost Christianities: The battles for Scripture and the Faiths we never knew		Theology	Oxford University Press	2003	Lending		978-0-19-518249-1		
104877	Ehrman Bart D: Edited:	Apostolic Fathers The Volume 1 :	The Loeb Classical Library President & Fellows of Havard College	Theology	Harvard University Press	2003	Lending		0-674-99607-0		
104822	Ehrman Bart D: Edited:	Apostolic Fathers The Volume 2 :		Theology	Harvard University Press	2003	Lending		0-674-99608-0		
106365	Einstein, Albert	World As I See It, The		Philosophy	Watts & Philosophical Library	1949	Lending				H/112
104208	Einstein, Albert	World As I See It, The		Philosophy	Watts & Philosophical Library	1943	Reference				H/112
101149	Eiseley, Loren	Darwin's Century		Evolution	Scientific Book Guild	1958	Lending				H/372
101150	Einsenman, Robert	The Dead sea scrolls and the first christians: Essays and translations		Christian	Element	1996	Lending		1-85230-785-4		
106104	Elbert, Jerome W.	Are Souls Real?		Soul	Prometheus	2000	Lending		1-57392-791-0		H/399
102755	Eldredge, Niles	Miner's Canary: Unravelling the Mysteries of Extinction		Evolution / Extinction	Virgin Books	1991	Lending	1	1-85227-455-7	$17.60	H/250
101151	Eldredge, Niles	Monkey Business, The: A Scientist Looks at Creationism		Creationism	Washington Square Press	1982	Lending		0-671-44115-5	$4.50	P/157
101152	Eldredge, Niles	Monkey Business, The: A Scientist Looks at Creationism		Creationism	Washington Square Press	1982	Reference		0-671-44115-5	$4.50	P/157
101153	Eldredge, Niles	Reinventing Darwin: The Great Evolutionary Debate		Evolution	Weidenfeld and Nicolson	1995	Lending		0-297-81603-9	$13.00	P/244
103131	Eliade, Mircea	Myths, dreams, and mysteries	The encounter between contemporary faiths and archaic realities	Mythology / Religion	Harper Torch Books	1957	Lending		0-06-131943-0		
106298	Eliade, Mircea	The Forge and the Crucible: The Origins and Structures of Alchemy	Translated from French by Stephen Corrin	Religion / Philosophy	The University of Chicago Press	1978	Lending		0-226-20390-5		
106233	Elliot Paul	Warrior Cults	history of mystical, murderous organisation			1995	Lending				
101154	Elliot Smith, G	Diffusion of Culture, The		Anthropology	Watts & Co	1933	Reference				H/244
104625	Elliot Smith, G	Essays on the Evolution of Man, The		Anthropology	Foreign Languages Moscow	1924	Reference				H/159
101155	Elliot Smith, G	In the Beginning		Anthropology	Watts & Co	1932	Lending				H/109
101157	Elliot Smith, G	In the Beginning		Anthropology	Watts & Co	1932	Reference				H/109
101156	Elliot Smith, G	Search for Man's Ancestors, The		Anthropology	Watts & Co	1931	Reference				H/56
101158	Ellis, Albert	Case Against Religion, The		Psychology	AAP	1980	Lending	2	0-910309-18-3		P/57
101159	Ellis, Albert	Case Against Religion, The		Psychology	AAP	1980	Reference		0-910309-18-3		P/57
100737	Ellis, Albert	Sex Without Guilt		Sex	Lyle Stuart New York	1963	Reference				H/200
101162	Ellis, Havelock	Criminal, The		Crime	Walter Scott	1910	Reference				H/440
101163	Ellis, Havelock	Dance of Life, The		Psychology	Constable	1933	Reference				H/340
101164	Ellis, Havelock	Man and Woman		Anthropology	Walter Scott	1904	Reference				H/488
101165	Ellis, Havelock	Morals, Manners and Men		Morality	Watts & Co	1939	Lending				
106341	Ellis, Havelock	Morals, Manners and Men		Morality	Watts & Co	1939	Lending				H/148
101167	Ellis, Havelock	Morals, Manners and Men		Morality	Watts & Co	1939	Reference				H/148
101166	Ellis, Havelock	My Life		Biography	Heinemann	1940	Reference				H/542
101168	Ellis, Havelock	Psychology of Sex		Psychology	Heinemann	1933	Reference				H/322
101169	Elsmore, Bronwyn	Creedism: Religious Prejudice in New Zealand		Religion / New Zealand	Nagare Press	1995	Lending	2			P/122
101171	Elsmore, Bronwyn	Creedism: Religious Prejudice in New Zealand		Religion / New Zealand	Nagare Press	1995	Lending				P/122
106641	Eltahawy Mona	Headscarves and Hymens	Why the middle east needs a sexual revolution	Muslim mysogony	farrar, straus & giroux	2015	Lending		978-086547-803-9		
101170	Elwin, Malcolm	Life of Llewelyn Powys		Powys, Llewelyn	John Lane The Bodley Head	1946	Reference				H/299
101186	Elwin, Malcolm	Old Gods Falling		Humanism	Collins London	1939	Reference				H/412
101187	Emerson, Ralph Waldo	Emerson's essays		Essays	London and Glasgow 		Lending				
106113	Emerson, Ralph Waldo	Candidate for Truth, A		Essays	Watts & Co	1938	Lending	1			H/146
101189	Emerson, Ralph Waldo	Candidate for Truth, A		Essays	Watts & Co	1938	Reference				H/146
101188	Emerson, Ralph Waldo	Essays and Other Writings		Essays	Cassell and Company	1907	Lending				425/H
101110	Encyclopedia Britannica	Aeschylus, Sophocles. Euripides. Aristophanes “ Plays” 	Great Books of the Western World : 46 Volumes	Plays	Published with the Editorial advice of the faculties of the University of Chicago	1952	Reference				
101190	Encyclopedia Britannica	Saint Augustine: The confessions, the city of God on christian doctrine		Christianity	Published with the Editorial advice of the faculties of the University of Chicago	1952	Reference				
100010	Encyclopedia Britannica	Aristotle. The works of Aristotle. Volume 1		Philosophy	Published with the Editorial advice of the faculties of the University of Chicago	1952	Reference				
100064	Encyclopedia Britannica	Aristotle 384-322 B.C. Volume 2		Philosophy	Published with the Editorial advice of the faculties of the University of Chicago	1952	Reference				
100046	Encyclopedia Britannica	Aquinas Saint Thomas	The Summa Theologica  Volume 1		Published with the Editorial advice of the faculties of the University of Chicago	1952	Reference				
