Barcode	Author	Title	Description	Keywords	Publisher	Date	Status	TimesLent	ISBN	Value	BindingPages
100715	Abbott, Geoffrey	Rack Rope & Red Hot Pincers	Instruments of torture through the ages	Torture	Headline	1993	Lending				
104177	Abbotson, Martin	Liberation of Germany, The                                                                         	Organized propaganda	Propaganda	Watts & Co	1931	Reference				
100005	Abel, Lionel	Important Nonsence	The nonsence of individuals	Nonsence	Prometheus	1985	Lending				
100004	Abel, Earnest	Wordlore & Folklore	Fact & Fantasy associated with alcohol	Alcohol	Prometheus	1987	Lending				
100006	Abercrombie, Nicholas	Dictionary of Sociology                                                                                    		Sociology	Penguin	1984	Lending				
100007	Acadamy of Humanism 	Neo Fundamentalism	Then Humanist Response	Humanism	Prometheus	1998	Lending				
106033	Abernethy, G.L.; Langford, T.A.	Philosophy of Religion		Philosophy	The Macmillan Company New York 	1968	Lending				
101966	Achtemeier, Paul J	Harpers Bible Dictionary		Bible		1st Edition	Reference				
101855	Ackerman, Diane	Natural History of the Senses, A				1996	Lending				
106562	Ackroyed, Peter	Thames Sacred River	prehistoric to present 	History	Chatto & Winduss                     The New     Zealand writers workshop 	2007	Lending				
102777	Ackroyed, Peter	Collection The: Essays	Ackroyeds chief reviewer for the Times	Literature	Chatto & Windus London	2001	Lending				
101958	Ackroyed, Peter	London The Biography	Biography of a City	Biography	Vintage	2000	Lending				
100715	Adams, Phillip	Adam Versus God                                                                                    		God		1985	Lending				
102796	Adams Charles                           	For Good & Evil	Impact of taxes on the course of civilization    Tax                                            			1999	Lending				
104461	Adler, Alfred 	Understanding Human Nature	Individual Psychology	Psychology	Greenberg Publishers New York	1927           Reference					
100009	Adler, Margot	Drawing Down the Moon                                                                              A Study of Neo-Paganism       	  	Witches & Druids	Beacon Press	1979	Lending				
106399	Aesop	Aesop's Fables	A new translation by Laura Gibbs	Literature	Oxford University Press	2002	Lending		978-0-19-954075-4		
104701	Agnew, Lisa	By the Pricking of my Thumbs	Ponerology the study of evil	Evil		2012	Lending		1468163213		
104148	Aiken, D Henry	Age of Ideology, The                                                                                        Philosophica lconflicts of the 19th Century 	Philisophical conflicts of the 19th Century	Philosophy	American library of world literature New york	1956	Lending				
104975	Ainsworth, Harrison	Old St. Paul's			Thomas Nelson and Sons	1841	Lending				
106430	Ainsworth, W.H.	The Lancashire Witches		Literature	Thomas Nelson and Sons		Lending				
106429	Ainsworth, W.H.	The Tower of London		Literature	Thomas Nelson and Sons	1840	Lending				
106645	Akbar, M.J.	The Shade of Swords	A cohesive history of jihad	Religion	Routledge UK	2002	Lending		0-425-32814-4		
101010	Akenson, Donald Harman	Surpassing Wonder	The invention of the bible & the Talmuds	Hebrew scriptures Talmuds of the rabbis	McGill-Queen's University Press	1998	Lending		0-15-100418-8		
104149	Akerley, Edward	X Rated Bible, The	Sex in the scriptures	Bible	American Atheist Press Austin Texas	1989	Lending		0-910309-19-1		
106290	Akerley, Edward	X Rated Bible, The	Sex in the scriptures	Bible	American Atheist Press Austin Texas	1989	Lending		0-910309-19-1		
104113	Allaby, Michael	Green Facts	The greenhouse effect & other key issues	Conservation	The Hamlyn Publishing Group London 	1986	Lending		0-600-566-188		
100019	Allaby, Michael	Facing the Future	The Case For Science	Science	Bloomsbury Publishing  London	1995	Lending		0-7475-2485-8		
104757	Allaby, Michael	Facing the Future	The Case For Science	Science	Bloomsbury Publishing  London	1995	Lending				
100203	Aldergrove, John Romney	Enemies	The rationalists View of Human Nature	Rationalism	Printed in Canada	1951	Lending		0-9682932-0-4		
104734	Aldred, Guy A	Richard Carlile  “agitator his life & times”	Political history 1790-1843	Atheist		1941	Lending				
104458	Alldritt, Charles	Worlds in Mind	Short stories fantastic fiction	Science Fiction	C Alldritt                    The New Zealand writers workshop 	1970	Lending		1st Edition		
104460	Alldritt, Charles	Thinking About Thinking	Humanism	Humanism	C Alldritt                    The New     Zealand writers workshop 	1978	Lending				
104459	Alldritt, Charles	Tree Worship	With individual myths & legends	Humanism	C Alldritt                    The New     Zealand writers workshop 	1965	Lending				
106445	Allen, Charlotte	Human Christ, The	The Search for the Historical Jesus	Theology	Library of Congress Cataloging	1998	Lending				
102572	Allen, Charlotte	Human Christ, The	The Search for the Historical Jesus	Theology	Library of Congress Cataloging	1998	Lending		0-7459-4235-0	$29.95	P/382
100027	Allen, Grant	Evolution of the Idea of God, The		Religious Anthropology	Watts & Co.	1903	Lending	1			H/
100028	Allen, Grant	Evolution of the Idea of God, The		Religious Anthroplogy	Watts & Co.	1931	Reference				H/308
100025	Allen, Grant	Hand of God and Other Posthumous Essays, The		Humanism	Watts & Co.	1909	Lending				H/114
100026	Allen, Grant	Hand of God and Other Posthumous Essays, The		Humanism	Watts & Co.	1909	Reference				H/114
104145	Allen, G W Harold	Edge of the Universe, The	A science fiction mystery novel	Science	Allen Book Publishing	1970	Lending				
100024	Allen, Grant	In Nature's Workshop		Biology	George Newnes Ltd	1901	Reference				H/240
100023	Allen, Grant	Story of the Plants, The		Botany	D Appleton	1910	Reference				H/218
104103	Allen L John	Rise of Benedict XVI The	Religion	Religion		2005	Lending				
100029	Allen, Steve	Steve Allen on the Bible, Religion, and Morality		Humour	Prometheus Books	1990	Lending	4	0-87975-638-1		H/428
  104649	Allen, Stewart Lee	In the Devil's Garden: a Sinful History of Forbidden Food	 a Sinful History of Forbidden Food	Food / History	Canongate	2003	Lending		1-84195-405-5	$14.00	312/P
104215	Allen & Unwin 	Bertrand Russell         Fact & Fiction	Fact & Fiction			1961	Lending				
103838	Allen & Unwin 	What I Believe	A collection of essays by different authors	Philosophy		1996	Lending				
106054	Allegro John	Dead Sea Scrolls The		Religion	Penguin	1956	Lending				
104146	Allegro John	Chosen People The				1971	Lending				
104141	Allegro John	Dead Sea Scrolls The		Religion		1956	Lending				
104731	Allegro John	Rationalist Annual The	Antony Flew, J.B.S.Haldane	Philosophy		1958	Lending				
100017	Alexander W. M. Menzies.	Demonic Possesion in the new Testament				1902	Reference				
104111	Alper Mathew	God part of the Brain The				2006	Lending				
104825	Altizer Thomas J. J.	History As Apocalypse		Social Studies	State University of New York Press Albany	1985	Lending		0-88706-014-5+		
106004	Altizer Thomas J. J.	The Descent into hell	A study of radical reversal of the christian consciousness	Social Studies	J.B. Lippincott Company	1970	Lending				
101054	Ambedkar Baba Saheb. Vol 1	Castes in India	Writings & Speeches	India	Gov't of Maharashtra	1989	Reference				
101079	Ambedkar Baba Saheb. Vol 2	Bombay legislature	Government India	India	Gov't of Maharashtra	1982	Reference				
101784	Ambedkar Baba Saheb. Vol 3	Philosophy of Hinduism : unpublished writings	Philosophy / India	India	Gov't of Maharashtra	1987	Reference				
101784	Ambedkar Baba Saheb. Vol 4	Untouchables : unpublished writings	History / India	India	Gov't of Maharashtra	1989	Reference				
101786	Ambedkar Baba Saheb. Vol 5	Ecomomics	Economics / India	India	Gov't of Maharashtra	1989	Reference				
101787	Ambedkar Baba Saheb. Vol 6	Who wre the Shudras	History / India	India	Gov't of Maharashtra	1990	Reference				
101788	Ambedkar Baba Saheb. Vol 7	Reprint of Pakistan	Partition of India	India	Gov't of Maharashtra	1990	Reference				
101789	Ambedkar Baba Saheb. Vol 8	What Congress & Ghandi have done to the untouchables	Political history / India	India	Gov't of Maharashtra	1991	Reference				
101790	Ambedkar Baba Saheb. Vol 9	Buddha & his Dhamma The	History / India	India	Gov't of Maharashtra	1992	Reference				
106660	Anatole France	The Life of Joan of Arc, Vol. 1 (translated by W Stephens)	History			1925	Reference				
106664	Anatole France	The Life of Joan of Arc, Vol. 2	Religious history								
106663	Anatole France	The Life of Joan of Arc, Vol. 3	Religious History								
106661	Anatole France	Mother of Pearl	procurator Judaea	religion							
100793	Anderson Benedict	Liberation of Germany, The                                                                         				1983	lending				
100032	Anderson & Leal	Enviro-Capitalists : Doing Good While Doing Well		Environmentalism / Capitalism	Rowman & Littlefield	1997	Lending		0-8476-8321-8	$45.95	H/189
100077	Anderson, G.W	Critical Introduction to the Old Testament		Biblical Studies	Duckworth	1962	Reference				H/261
104651	Applebaum Anne	Gulag	A History of the Soviet Camps			2003	Lending				
100033	Anderson, Terry L. & Huggins, Laura E.	Property Rights: A Practical Guide to Freedom and Prosperity		Politics / Philosophy	Hoover Institution Press	2003	Lending		0-8179-3912-1	$29.95	94/P
102552	Andrade & Huxley	Forces at Work		Science	Basil Blackwell	1946	Reference				H/270
100034	Andreski, Stanislav (Ed.)	Herbert Spencer: Structure, Function, and Evolution		Spencer, Herbert	Thomas Nelson and Sons	1972	Lending		0-17-712081-9		P/257
100035	Andrews, R. & Schellenberger, .	Tomb of God, The                                                                                   	A  solution to a 2,000 year old mysrery 	Jesus	Little, Brown & Co.	1996	Lending	2	0-316-87997-5		H/513
100035	Angeles, Peter (ed)	Critiques of God	A collection of essays by different authors	Essays / God	Prometheus Books	1976	Lending		0-87975-078-2		P/371
100036	Angeles, Peter A	Problem of God, The : A Short Introduction		Atheism	Prometheus Books	1980	Lending		0-87975-216-5		P/156
104144	Angell Norman	Human Nature & the Peace Problem	The human instinct to fight	Philosophy	W Collins & sons ltd.	1925	Lending				
100164	Angus, Samuel	Mystery - Religions and Christianity, The		Christianity / Other Religions	University Books	1966	Lending				H/359
101439	Anon.	One Hundred Great Lives: 	Revealing biographies of Scientists	Biography	Odhams Press Ltd.	1948	Lending			$4.00	H/760
102815	Anon.	Religions of the World, The		Comparative Religion	Charles Griffin and Company	1879	Reference				H/386
102803	Anon.	World's Most Famous Court Trial, The	 Tennessee Evolution Case	Scopes Trial	National Book Company	1925	Lending				H/339
100038	Anon.	World's Most Famous Court Trial, The 	 Tennessee Evolution Case	Scopes Trial	National Book Company	1925	Reference				H/339
106112	Anouilh, Jean	Becket	Translated by Lucienne Hill	Play	Methuen	1961	Lending				
106079	Apocrypha	Septuagint Apocrypha	Greek to english translation	Theology	Samuel Bagster & sons ltd London		Lending				
100039	Aquinas, St. Thomas	Summa Theologica VI		Theology	Encyclopedia Brittanica	1274	Lending				H/826
100040	Aquinas, St. Thomas	Summa Theologica VII		Theology	Encyclopedia Britannica	1274	Lending				H/1085
100041	Arch, Robert(Pseud) Robertson, Archibald	Whence, Whither and Why?		Philosophy	Watts & Co.	1926	Reference				H/106
104131	Archer  William	God & Mr Wells		Philosophy		1917	Reference				
100043	Archer, William	Life, Trial, and Death of Fransisco Ferrer, The		Biography	Chapman & Hall	1911	Reference				H/322
100042	Archer, William	William Archer as Rationalist		Rationalism	Watts & Co.	1925	Lending				H/240
100045	Archer, William	William Archer as Rationalist		Rationalism	Watts & Co.	1925	Reference				H/240
100044	Ardrey, Robert	African Genesis		Anthropology	Collins	1963	Lending				P/416
100147	Ardrey, Robert	African Genesis		Anthropology	Collins	1963	Reference				H/380
100672	Argan, Giulio Carlo	Botticelli		Art History / Botticelli	Skira	1957	Lending				H/146
100672	Aristotle	Politics, The		Philosophy / Politics	Penguin Books	1985	Lending			$6.60	P/306
100046	Aristotle	Works of Aristotle VI		Philosophy	Encyclopedia Brittanica	1952	Lending				H/726
100047	Aristotle	Works of Aristotle VII		Philosophy	Encyclopedia Brittanica	1952	Lending				H/699
106436	Aristotle	Aristotle: Selections from Nicomachean Ethics Politics		Philosophy	The Collector's Library of Essential Thinkers	2004	Lending		1-904919-11-1		
106102	Armesto, Felipe	Ideas that changed the world		History/Philosophy	Dorling Kindersley Limited	2003	Lending		0-7513-44141		
106329	Armstrong, Karen	Battle for God, The	Fundamentalism in Judaism, Christianity and Islam	Fundamentalism	HarperCollins	2001	Lending		0-00-638348-3		
106240	Armstrong, Karen	In the Beginning: A new interpretation of Genesis		Religious History	Ballantine Books	1996	Lending		0-345-40604-4		
106204	Armstrong, Karen	A short history of Myth		Mythology	Canongate	2005	Lending		1-84195-644-9		
100052	Armstrong, Karen	Gospel According To Woman The	A History  of Woman in Christianity			1986	Lending				
100048	Armstrong, Karen	Beginning the World	A former nun story of her life	Autobiography	Pan	1983	Lending	1	0-330-28409-6		P/243
101959	Armstrong, Karen	History of God, A	A biography of belief	Religious History	Mandarin	1994	Reference	2	0-7493-0692-0		P/511
106379	Armstrong, Karen	History of God, A	A biography of belief	Religious History	Mandarin	1994	Lending		0-7493-0692-0		
100053	Armstrong, Karen	Through the Narrow Gate : A Nun's Story		Autobiography	Macmillan	1981	Lending	1	0-330-26664-0		P/284
106393	Armstrong, Karen	The Case for God		Theology	The Bodley Head	2009	Lending		978-1-847-92035-5		
100057	Armstrong, R.A	Agnosticism and Theism in the Nineteenth Century		Agnosticism	Philip Green	1905	Reference				P/207
106603	Arnold, Matthew	Matthew Arnold's Essays in Criticism	ed CK Chesterton	Literary Criticism	Everyman's Library	1969	Lending				
106129	Arnold, Matthew	Literature and Dogma	An essay towards a better apprehension of the Bible	Bible	Thomas Nelson and Sons	1873	Lending				
100055	Arnold, Matthew	God and the Bible		Bible	Smith Elder	1893	Lending				H/239
100054	Arnold, Matthew	God and the Bible		Bible	Smith Elder	1893	Reference				H/394
106024	Ash, Brian [Ed]	The Visual Encyclopedia of Science Fiction		Science	Pan	1977	Lending		0-330-25275-5		
106557	Ashton-Warner, Sylvia	Incense of Idols	Fiction	Literature / Religion	Secker & Warburg	1960	Lending				
106053	Asimov, Isaac	Asimov's Guide to the Bible	Two Volumes in one: The old and new testament	Bible	Avenel Books	1981	Lending		0-517-34582-X		
100058	Asimov, Isaac	Asimov's New Guide to Science		Science	Viking	1985	Lending	4	0-670-80347-2		H/940
100059	Asimov, Isaac	In the Beginning	Science Faces God Book of Genesis			1981					
100062	Asimov, Issac	Asimov's Guide to the Bible		Bible	Wings Books	1981	Lending	5	0-517-34582-X		H/1295
100059	Asimov, Isaac	Asimov's Guide to the Bible				1969	Reference				
102591	Aslen Ahmet	Islam Civil Society & Market Economy				1999	Lending				
102599	Attenborough, David	Life on Earth		Biology	Collins / British Broadcasting Corporation	1979	Lending		0-00-219091-5	$4.00	H/319
100063	Attenborough, David	Living Planet, The		Biology	Collins & BBC	1985	Lending		0-00-219139-3	NZ$29.95	H/320
100065	Attenborough, David	Trials of Life, The		Biology	Collins & BBC	1990	Lending		0-00-219912-2		H/320
104856	Aubrey M. E.	Ministers Manuel A	Containing Orders of Service	Theology	Carey Kingsgate Press Ltd	1927	Lending				
100064	Augustine, Saint	Confessions of St Augustine, The		Philosophy	J.M. Dent & Sons	1917	Reference				H/348
102044	Augustine, Saint	Confessions, The; City of God, The; On Christian Doctrine		Theology	Encyclopedia Brittanica	1952	Lending				H/698
100067	Augustine, St.	Of True Religion		Philosophy	Henry Regnery Company	1966	Lending			$4.95	P/107
100066	Aurelius, Marcus	Meditations of Marcus Aurelius, The		Philosophy	Everyman's Library	1949	Lending				H/182
100373	Aurelius, Marcus	Meditations of Marcus Aurelius, The		Philosophy	Collins & JM Dent	1976	Reference				H/317
106354	Austen, Jane	Northanger Abbey		Literature	Oxford University Press	1930	Lending				
106269	Ayer, A J. 	The Meaning of Life	Essays by the author of Language, Truth and Logic	Philosophy	Charles Scribner's Sons	1990	Lending		0-684-19195-4		
104989	Ayer, A J. 	Language truth and logic		Philosophy	Camelot Press	1955	Lending				
104401	Ayer, A J. 	Autobiography of Bertrand Russell The 1914-1944				1951	Lending				
104402	Ayer, A J. 	Autobiography of Bertrand Russell The 1944-1966				1951	Lending				
104399	Ayer, A J. 	Bertrand Russell Phiosopher of the Century	Essays	Philosophy		1967	Lending				
104462	Ayer, A J. 	Central Questions of Philosophy The				1976	Lending				
100075	Ayer, A J. (Ed.)	Theism and Humanism		Humanism	Pemberton	1963	Lending				H/296
100073	Ayer, A J. (Ed.)	Humanist Outlook, The		Humanism	Pemberton	1963	Reference				H/296
100072	Ayer, A.J.	Meaning of Life, The		Humanism	South Place Ethical Society	1988	Lending	1	0-902368-14-1		P/33
100426	Ayer, A.J.	Meaning of Life, The		Humanism	South Place Ethical Society	1988	Reference		0-902368-14-1		P/33
100071	Ayer, A.J.	Metaphysics and Common Sense		Philosophy	Macmillan	1973	Lending				P/267
104400	Ayer, A J. 	On Education				1926	Lending				
102859	Ayer, A J. 	Philosophy in the Twentieth Century		Philosophy		1982	Lending				
100070	Ayer, A.J.	Philosophical Essays		Philosophy	Greenwood Press	1980	Lending	1	0-313-20902-2		H/289
104403	Ayer, A J. 	Power				1938	Lending				
100427	Ayer, A.J.	Thomas Paine		Biography	Secker & Warburg	1988	Lending	1	0-436-02820-4		H/194
100425	Ayer, A.J. et al.	Towards an Open Society		Humanism	Pemberton	1971	Lending				P/130
100428	Azzam, Abd-al-Rahman	Eternal Message of Muhammed, The		Islam	Quartet Books	1979	Lending	1	0-7043-3203-5		P/297
100429	Babinski, Edward T	Leaving the Fold : Testimonies of Former Fundamentalists		Fundamentalism	Prometheus	1995	Lending	2	0-87975-907-0		H/462
102527	Bacon, Francis	Advancement of Learning; Novum Organum; New Atlantis		Philosophy	Encyclopedia Brittanica	1952	Lending				H/214
100432	Bacon, Francis	Complete Essays of Francis Bacon, The		Philosophy / Bacon, Francis	Washington Square Press Inc.	1963	Lending				P/307
100433	Bacon, J S D	Chemistry of Life, The		Biochemistry	Watts & Co.	1947	Lending				H/120
100430	Bacon, J S D	Chemistry of Life, The		Biochemistry	Watts & Co.	1947	Reference				H/120
100431	Bacon, J S D	Science of Heredity		Evolution	Watts & Co.	1951	Lending				H/192
101379	Bacon, J S D	Science of Heredity		Evolution	Watts & Co.	1951	Reference				H/192
100435	Bacque, James	Crimes and Mercies: The Fate of German Civilians Under Allied Occupation, 1944-1950		History / Germany	Warner Books	1997	Lending		0-7515-2277-5	$12.00	P/288
100434	Baigent, Leigh & Lincoln	Messianic Legacy, The		Messianism	Corgi Books	1986	Lending	2	0-552-13182-2		P/500
100985	Baigent, Leigh & Lincoln	Messianic Legacy, The		Messianism	Corgi Books	1986	Reference		0-224-02185-0		H/364
104267	Baigent Michael	Dead Sea Scrolls The				1991	Lending				
100985	Baigent Michael	Holy Blood & the Holy Grail		History		1982	Lending				
104930	Baigent, M.; Leigh, R.; Lincoln, H.	The Holy blood and the holy grail		History 	Century	2005	Lending		1-8441-3840-2		
102928	Bailey & Darden	Mad Man in Waco		Cults	WRS Publishing	1993	Lending	2	1-56796-027-8		P/284
100437	Bailey, Ronald (ed)	Global Warming and Other Eco-Myths : How the Environmental Movement Uses False Science to Scare Us to Death		Deep Ecology /  Environmentalism	Forum	2002	Lending		0-7615-3660-4	$54.95	H/423
106125	Baillie, John	And the life everlasting		Theology	Oxford University Press	1934	Lending				
100438	Bains, William	Genetic Engineering for Almost Everybody		Genetic Engineering	Penguin	1987	Lending	1	0-14-022740-7		P/214
106606	Bradley Raymond D	God's Gravediggers; why no Diety exists		Atheism	Ochamam Publishing	2015	Lending				
106607	Bradley, Raymond D	God's Gravediggers; why no Diety exists		Atheism							
100714	Baird, Robert & Rosenbaum, Stuart (eds)	Euthanasia : The Moral Issues		Euthanasia / Ethics	Prometheus Books	1989	Lending	2	0-87975-555-5		P/216
100441	Baird, Robert & Rosenbaum, Stuart (edS)	Hatred, Bigotry, & Prejudice : Definitions, Causes, and Solutions		Politics / Hate	Prometheus Books	1999	Lending		1-57392-748-1	$US16.11	P/288
100430	Bacon J S D	Science of Heredity The				1951					
100431	Bacon J S D	Science of Heredity The				1951					
106028	Baigent, M.; Leigh, R.; Lincoln, H.	The Messianic Legacy		Christianity	Corgi Books	1987	Lending		0-552-13182-2		
106293	Baigent, Michael	The Jesus papers	Exposing the greatest cover-up in history	Christianity	Harper Element	2006	Lending		0-00-724122-4		
100439	Baker, I Newton	Intimate View of Robert G Ingersoll, An		Biography	C P Farrell	1920	Reference				H/207
104165	Baker Brian	From Faith to Reason				2009	Lending				
100440	Baldwin, James Mark	History of Psychology		Psychology	Watts & Co.	1913	Lending				H/168
100441	Baldwin, James Mark	History of Psychology		Psychology	Watts & Co.	1913	Reference				H/168
100444	Balfour, Arthur James	Theism and Humanism		Humanism	Hodder and Stoughton	1914	Reference				H/274
104168	Ball P W & W G Foote	Bible Handbook The				1961	Reference				
104160	Ball P W & W G Foote	Bible Handbook The				1961	Lending				
104169	Ball P W & W G Foote	Bible Handbook The				1961	Lending				
100443	Ball, Sir Robert	Earth's Beginning, The		Cosmology	Cassell and Company	1903	Reference				H/384
100446	Ball, Sir Robert	Story of the Heavens, The		Cosmology	Cassell and Company	1891	Reference				H/555
100447	Ballou, Robert	Bible of the World, The		Religious Texts	Kegan Paul Trench Trubner	1946	Reference				H/1415
106215	Banham, Martin	The Cambridge guide to theatre		Theatre / Entertainment	Cambridge University Press	1988	Lending		0-521-434378		
100448	Bard, Martin L	Peril of Faith, The		Religion / Atheism	Gustav Broukal Press	1990	Lending	1	0-910309-64-7		P/175
106107	Baring, Anne; Cashford, Jules	The Myth of Goddess: Evolution of an image		Goddess	Arkana Penguin Books	1993	Lending		0-14-019292-1		
106477	Baring-Gould W.S.	Lure of the Limerick The	Collection of Limericks	Limericks	Granada Publishing Lmtd	1967	Lending		0-246-97462-3		
101001	Barlow Nora	Autobiography of Charles Darwin The 1809-1882		Autobiography		1958	Lending				
100449	Barnard, Christiaan	Good Life Good Death : A Doctor's Case for Euthanasia and Suicide		Euthanasia / Suicide	Prentice Hall	1980	Lending		0-13-360370-9		H/146
102699	Barnes, Ernest William	Rise of Christianity, The		Christianity / Origins	Longmans Green	1948	Reference				H/356
102707	Barnes, Harry Elmer	Intellectual and Cultural History of the Western World (Vol. 1: From Earliest times Through the Middle Ages)		History	Heron Books	1965	Lending			$27.50	H/545
106547	Barnes, Harry Elmer	Intellectual and Cultural History of the Western World (Vol. 1: From Earliest times Through the Middle Ages)		History 	Heron Books	1965	Lending				
102017	Barnes, Harry Elmer	Intellectual and Cultural History of the Western World (Vol. 2: From the Renaissance Through thr Eighteenth Century)		History	Heron Books	1965	Lending			$27.50	H/404
100450	Barnes, Harry Elmer	Intellectual and Cultural History of the Western World (Vol. 3: From the Ninteenth Century to the Present Day)		History	Heron Books	1965	Lending			$27.50	H/399
102724	Barnes, Harry Elmer	Twilight of Christianity, The		Christianity	Richard R. Smith, Inc	1931	Reference				H/470
102683	Barnes, Hazel E.	University as the New Church, The		University / Religion	Watts & Co. Ltd	1970	Lending				H/198
100451	Barnhart, Joe E.	Jim and Tammy: Charismatic Intrique Inside PTL		Pentecostalism	Prometheus Books	1988	Lending	1	0-87975-460-5		H/266
106397	Barnstone, Willis; Meyer, Marvin;	The Gnostic Bible	Gnostic Texts of Mystical wisdom from the ancient and medieval worlds – Pagan, Jewish, Christian, Mandaen, Manichaean, Islamic and Cathar	Gnosticism	New Seeds	2006	Lending		1-59030-199-4		
106506	Barr, James	Fundamentalism		Religion / Politics	SCM Press Ltd	1977	Lending				
100452	Barraclough, G	Introduction to Contemporary History, An		History	Watts & Co	1966	Reference				H/274
102598	Barraclough, Geoffrey	Medieval Papacy, The		Catholocism / History	Thames & Hudson	1968	Lending				P/216
100706	Barraclough, Geoffrey	Times Atlas of World History, The		History	Collins	1978	Reference				H/360
104150	Bartley F Robert	Star Studded Hoax of Christianity The				1969					
100796	Barrett, Stephen & Jarvis, 	Health Robbers The	A close look at quackery in America	Pseudoscience	Prometheus Books	1993	Lending	2	0-87975-855-4	$US25.95	H/526
104660	Barr Alan P : Editor	Thomas H Huxleys Place in Science & letters		History		1997	Lending				
104863	Barr James	Old & New In Interpretation		Theology	SCM Press Ltd.	1966	Lending		334-01162-0		
106189	Barr. James	The Semantics of Biblical Language		Theology	SCM Press Ltd	1983	Lending		334-02323-8		
106088	Barr. James	Beyond Fundamentalism	Bibical foundations for Evangelical Christianity	Theology	Westminster Press phlidalphea	1984	Lending		0-664-24620-6		
104855	Barr James	Bible in the Modern World The		Theology	S C M Press Ltd london	1973	Lending				
101657	Barrow, Logie	Independent Spirits: Spiritualism and Enlish Plebians 1850-1910		History / Spiritualism	Routledge & Kegan Paul	1986	Lending		0-7102-0815-4		P/338
102868	Barrow John D	Origin of The Universe		Cosmology		1994	Lending				
101213	Barrowman, Rachel	Mason: The Life of RAK Mason		Biography / Mason, R.A.K.	Victoria University Press	2003	Lending		0-86473-463-8		455/P
102604	Barstow, Anne Llewellyn	Witchraze: A New History of the European Witch Hunts		Witchcraft / Europe	HarperCollins	1994	Lending		0-06-251036-3	$10.00	P/255
101308	Bartocci, Gianni	Stars and Solitude		Poetry	Dorrance & Company	1969	Reference				P/49
