Barcode	Author	Title	Description	Keywords	Publisher	Date	Status	TimesLent	ISBN	Value	BindingPages
106521	Partridge, Eric	Usage and abusage: A guide to good english	This book wittily attacks linguistic abuse of all kinds	Language 	Harpers and Brothers	1942	Lending				
106415	Pascal, Blaise	Pensees		Literature	Penguin Books	1981	Lending				
106473	Patai Raphael	Hebrew Goddess		Theology	Wayne State University Press	1991	Lending		0-8143-2221-2		
104347	Passmore, John	Philosophical Reasoning		Philosophy	Charles Scribner's Sons	1961	Lending			$29.95	P/149
102677	Patch, Blanche	Thirty Years with G.B.S	George Bernard Shaw	Shaw, George Bernard	Victor Gollancz	1951	Reference				H/256
102678	Patterson Walter	Nuclear Power				1976	Lending				
104341	Paterson, William Romaine	Problems of Destiny		Humanism	Watts & Co.	1935	Lending				H/220
102679	Paterson, William Romaine	Problems of Destiny		Humanism	Watts & Co.	1935	Reference				H/220
100151	Paul, John	Catechism of the Catholic Church		Catholicism	CEPAC	1994	Reference				H/892
100980	Peacock, James L.	Anthropological Lens, The: Harsh Light, Soft Focus		Anthropology	Cambridge University Press	1988	Lending		0-521-33748-8		P/124
102681	Peake, Harold	Early Steps in Human Progress		Anthropology	Sampson Low, Marston	1920	Reference				H/256
103436	Pearson, Hesketh	Doctor Darwin		Darwin	Penguin	1943	Reference				H/143
102682	Pearson, Hesketh	G.B.S: A Postcript		Biography / Shaw, G.B.	Collins	1951	Reference				H/192
103412	Pearson Carl	Ethic of Freethought The		Freethought		1901	Reference				
104542	Pennock, Robert T.	Tower of Babel: The Evidence Against the New Creationism		Creationism / Critique	MIT Press	2000	Lending		0-262-66165-9		P/429
106425	Pepper, Margaret [ed.]	The Macmillan dictionary of religious quotations		Religion	MacMillan		Lending		0-333-65378-5		
102685	Pernoud, Regine	Crusades, The		History / Crusades	Secker & Warburg	1962	Lending				H/295
100061	Penrose Roger	Shadows of the Mind	Search for missing science of consciousness	Science		1994	Lending				
104541	Perry, John	Dialogue on Personal Identity and Immortality, A.		Philosophy / Metaphysics	Hackett Publishing Company	1978	Lending		0-915144-53-0	$13.95	P/49
102689	Perry, John	Dialogue on Personal Identity and Immortality, A.				1978	Lending				
103439	Perrycoste, Frank Hill	Influence of Religion Upon Truthfulness, On the		Religion / Ethics	Watts & Co.	1913	Lending				H/324
102690	Perrycoste, Frank Hill	Influence of Religion Upon Truthfulness, On the		Religion / Ethics	Watts & Co.	1913	Reference				H/324
102686	Perrycoste, Frank Hill	Religion and Moral Civilisation		Religion / Ethics	Watts & Co.	1915	Lending				H/202
102688	Perrycoste, Frank Hill	Religion and Moral Civilisation		Religion / Ethics	Watts & Co.	1915	Reference				H/202
102597	Person, Ethel S.	Force of Fantasy, The		Psychology	Harper Collins	1995	Lending			NZ$17.95	P/276
102691	Person, Ethel S.	Force of Fantasy, The		Psychology		1997	Reference				
106636	Peters Roger	William Shakespeare's philosophy Volume 1	The sonnet logic	Philosophy Of Sonnet	Roger Peters	2005	Reference				
106081	Peterson, Merrill D.	Thomas Jefferson and the New Nation		Biography  	The Easton Press	1970	Lending				
102597	Petto A.J. & L. R Godfrey : Ed'	Scientists Confront Intelligent Design & Creationism	science agauinst creationism	Science/ History	Harvard University Press	1998	Lending				
104766	Petrovic, Vojislav Maksim	Hero Tales and Legends of the Serbians		Mythology	George G.Harrap & Co.	1921	Reference				H/393
106549	Pfeiffer, Charles F.	The dead sea scrolls and the bible		Christianity	Baker Book House	1969	Lending				
102693	Phelips, Vivian	Concerning Progressive Revelation		Christian Critique	Watts & Co.	1936	Lending				H/118
102692	Phelips, Vivian	Concerning Progressive Revelation		Christian Critique	Watts & Co.	1936	Reference				H/118
102695	Phelips, Vivian	Modern Knowledge and Old Beliefs		Mythology	Watts & Co.	1934	Lending				H/138
102694	Phelips, Vivian	Modern Knowledge and Old Beliefs		Mythology	Watts & Co.	1934	Reference				H/138
103440	Phelips, Vivian	Churches & Modern Thoughts The				1931	Reference				
104539	Philips, Michael (ed)	Philosophy and Science Fiction		Science Fiction / Philosophy	Pometheus Books	1984	Lending	1	0-87975-248-3		P/392
102702	Philp, Mark	Paine	Thomas Paine	Biography / Paine, Thomas	Oxford University Press	1989	Lending				P/130
102703	Philosophical Library	Wisdom of Confucius		Confucius		1968	Lending				
104540	Physicus	Candid Examination of Theism A		Theism		1913	Reference				
104536	Picton, J Allanson	Bible in School, The		Education	Watts & Co.	1907	Reference				H/79
102708	Piggot Adrian	Vatican Versus Mankind The		Catholicism		nil	Lending				
104728	Piggot Adrian	Vatican Versus Mankind The		Catholicism		nil	Lending				
104727	Pike, E. Royston	Encyclopedia of Religion and Religions		Comparative Religion	George Allen & Unwin London	1951	Lending				H/406
102709	Pike, E. Royston	Encyclopedia of Religion and Religions		Comparative Religion	George Allen & Unwin London	1951	Reference				H/406
102715	Pike, E. Royston	Ethics of the Great Religions		Ethics / Religion	Watts & Co.	1948	Reference				H/241
102711	Pike, E. Royston	Ethics of the Great Religions		Ethics / Religion		1948	Lending				
104349	Pike, E. Royston	Faiths of Many Lands		Comparative Religion	Watts & Co.	1945	Lending				H/103
102712	Pike, E. Royston	Faiths of Many Lands		Comparative Religion	Watts & Co.	1945	Reference				H/103
102713	Pike, E. Royston	Jehovah's Witnesses		Jehovah's Witnesses	Watts & Co.	1954	Lending				H/140
102714	Pike, E. Royston	Jehovah's Witnesses		Jehovah's Witnesses	Watts & Co.	1954	Reference				H/140
102710	Pike, E. Royston	Pioneers of Social Change		History / Politics	Barrie & Rockliff	1963	Lending				P/218
103441	Pike, E. Royston	Pioneers of Social Change		History / Politics	Barrie & Rockliff	1963	Reference				H/218
102716	Pike, E. Royston	Pioneers of Social Change				1963	Lending				
104350	Pike, E. Royston	Slayers of Superstition: A Popular Account of Some of the Leading Personalities of the Deist Movement		Deism	Watts & Co.	1931	Lending				H/106
102717	Pike, E. Royston	Slayers of Superstition: A Popular Account of Some of the Leading Personalities of the Deist Movement		Deism	Watts & Co.	1931	Reference				H/106
102719	Pike, E. Royston	Story of the Crusades, The		History / Crusades	Watts & Co.	1927	Lending				H/89
102720	Pike, E. Royston	Story of the Crusades, The		History / Crusades	Watts & Co.	1927	Reference				P/89
102718	Pike, E. Royston	Temple Bells, or the Faiths of Many Lands		Christianity / Critique	Watts & Co.	1930	Reference				H/148
103410	Pinn Anthony B	African American Humanists Principles		Humanism		2004	Lending				
104538	Pinker, Steven	Blank Slate, The: The Modern Denial of Human Nature		Evolutionary Psychology	Allen Lane / Penguin	2002	Lending		0-713-99256-5	$39.95	P/509
103414	Pinker, Steven	How the Mind Works		Psychology	Penguin Books	1998	Lending		0-14-024491-3		P/660
106412	Piper David	illustrated History of Art The	Art through the ages	Art	Chancellor Press Britain	1981	Lending				
103442	Pinker, Steven	Language Instinct, The		Psychology / Linguistics	Penguin Books	1994	Lending		0-14-017529-6	$7.70	P/494
103443	Pirie George	Memoirs 	past council member N.Z.A.R.H				Lending				
104351	Pitts Michael & M Roberts	Fairweather Eden	archeologists at Boxgrove England	archeology		1998	Lending				
106501	Pittenger, Norman	Process Thought and Christian Faith		Theology	James Nisbet & Co. Ltd.	1968	Lending				
106370	Plato	Timaeus and Critias		Philosophy	Penguin	1965	Lending				
104537	Plato	Dialogues of Plato, The; Seventh Letter, The		Philosophy	Encyclopedia Brittanica	1952	Reference				H/814
103431	Plato	Early Socratic Dialogues		Philosophy	Penguin	1987	Lending		0-14-044447-5	$9.00	P/395
106508	Plato	Early Socratic Dialogues		Philosophy	Penguin	2005	Lending		978-0-14-045503-8		
103097	Plato	Essential Plato, The		Philosophy	The Softback Preview	1999	Lending			$18.00	P/1323
106451	Plato	Last Days of Socrates, The		Philosophy	Penguin	1993	Lending				
103423	Plato	Last Days of Socrates, The		Philosophy	Penguin	1993	Lending		0-14-04452-X	$19.95	P/237
103424	Plato	Republic, The		Philosophy	Penguin	1975	Lending			$5.50	P/467
106507	Plato	Republic, The		Philosophy	Penguin	2007	Lending		978-0-140-45511-3		
106550	Plato	The Symposium		Philosophy	Penguin	1999	Lending		978-0-140-44927-3		
102723	Platt, Charles	Popular Superstitions		Mythology	Strahan London	1925	Reference				H/244
106299	Plimer, Ian	Heaven + earth. Global Warming: The missing science		Enviornment	Howling at the Moon Publishing LTD	2009	Lending		978-0-9582401-5-4		
102725	Plimer, Ian	Telling Lies For God: Reason vs. Creationism		Creationism	Random House	1994	Lending	16			P/303
103445	Plimer, Ian	Telling Lies For God: Reason vs. Creationism		Creationism	Random House	1994	Reference				P/303
106131	Plinius Gaius, Gaius	Natural history: A selection	Pliny the elder	History 	Penguin	1991	Lending		0-14-044413-0		
106093	Plinius Gaius	letters of the younger Pliny The	Editor: Betty Radice	History	Cox & Wyman Ltd	1963	Lending				
102727	Plotinus	Six Enneads, The		Plotinus	Encyclopedia Brittanica	1952	Reference				H/360
103446	Plotkin, Henry	Darwinian Machines and the Nature of Knowledge		Biology / Philosophy	Penguin Books	1994	Lending		0-14-023092-0	$7.00	P/269
102726	Plott, John	Global History of Philosophy Vol 1		Philosophy	Motilal Banarsidass	1963	Lending				H/240
102729	Plott, John	Global History of Philosophy Vol 2		Philosophy	Motilal Banarsidass	1979	Lending				H/344
106224	Plunket Emmeline	Calenders and Constellations of The Ancient World		Astrology         	Random House UK	1997	Lending		1-85958-488-8		
102728	Plutarch	Lives of the Noble Grecians & Romans, The		Ancient History	Encyclopedia Brittanica	1952	Reference				H/897
102730	Poe, Edgar Allen	Works of Edgar Allen Poe, The (Vol 1, Tales)		Literature	A & C Black	1899	Reference				H/513
102942	Polanyi, Michael	Logic of Liberty, The : Reflections and Rejoinders		Liberty	Liberty Fund	1998	Lending		0-86597-183-8	$39.95	P/256
102733	Pollack Robert	Signs of Life	the language & Meaning of D.N.A.			1994	Lending				
104352	Pomeroy, W.B	Boys and Sex		Sex / Childrens	Pelican Books	1975	Lending	1			P/140
102732	Pomeroy, W.B	Girls and Sex		Sex / Childrens	Pelican Books	1973	Lending	1			P/136
103420	Pond, Fisher et.al	History of American Constitutional or Common Law, The: With Commentary Concerning Equity and Merchant Law		Law / America	The Message Company	1995	Lending		1-572-82010-1	$24.95	P/142
102602	Ponting Clive	Green History of the World The				1991	Lending				
104354	Pool, Robert	Negotiating a Good Death : Euthanasia in the Netherlands		Euthanasia / Netherlands	The Haworth Press, Inc.	2000	Lending	1	0-7890-1080-1	$49.95	H/253
104950	Pool, James	Who financed Hitler: The secret funding of Hilter's Rise to power 1919-1933		History / Hitler	Pocket books	1978	Lending		0-671-76083-1		
106280	Pope Alexander	Iliad of Homer The			Oxford university Press	1959	Lending				
103447	Pope Innocenti VIII	Malleus Maleforicum		Witches	John Rodker London	1928	Reference				
102735	Popper, Karl	Conjectures and Refutations		Philosophy	Routledge & Kegan Paul	1972	Lending				P/431
103421	Popper, Karl	Conjectures and Refutations: The Growth of Scientific Knowledge		Philosophy	Routledge & Kegan Paul	1972	Lending		0-7100-6508-6	$22.00	P/431
101060	Popper, Karl	Open Society & Its Enemies, The: Volume 1 Plato		Philosophy / Politics	Routledge	1969	Lending	1		$NZ 11	P361
101061	Popper, Karl	Open Society & Its Enemies, The: Volume 2 Hegel & Marx		Philosophy / Politics	Routledge	1969	Lending	1		$NZ 11	P.240
102736	Popper, Karl	Pocket Popper, A		Philosophy	Fontana	1983	Lending		0-00-636414-4		P/468
103427	Popper, Karl	popper Selections		Philosophy		1985	Lending				
103427	Popper, Karl	Poverty of Historicism		Philosophy		1991	Lending				
102737	Popper, Karl	Unended Quest		Autobiography / Popper, Karl	Fontana / Collins	1976	Reference		0-415-08693-0		P/270
106518	Popper, Karl	Objective Knowledge: An evolutionary approach		Philosophy	Clarendon Press	1986	Lending		0-19-875024-2		
103449	Poulton, Edward B	History of Evolution, The		Evolution / History	Watts & Co	1937	Lending				H/40
102738	Poulton, Edward B	History of Evolution, The		Evolution / History	Watts & Co	1937	Reference				H/40
103452	Poundstone, William	Labyrinths of Reason: Paradox, Puzzles, and the Frailty of Knowledge		Philosophy	Anchor Books	1988	Lending		0-385-24261-1	$49.95	H/274
102740	Powell, B F	Bible of Reason		Rationalism	J Watson	1853	Reference				H/
103411	Powell, B F	Bible of Reason	scriptures of ancient morals	Rationalism		1853	Reference				
102740	Powers, H.H & Archer, W	Religion of Tomorrow, The		Humanism	Watts & Co	1925	Lending				H/72
102741	Powers, H.H & Archer, W	Religion of Tomorrow, The		Humanism	Watts & Co	1925	Reference				H/72
102748	Powys, Llewelyn	Cradle of God, The		Christianity / Critique	Watts & Co	1949	Reference				H/194
102745	Powys, Llewelyn	Damnable Opinions		Christianity / Critique	Watts & Co	1935	Lending				H/116
102744	Powys, Llewelyn	Damnable Opinions		Christianity / Critique	Watts & Co	1935	Reference				H/116
102746	Powys, Llewelyn	Pathetic Fallacy: A Study of Christianity, The		Christianity / Critique	Watts & Co	1934	Lending				H/115
102747	Powys, Llewelyn	Pathetic Fallacy: A Study of Christianity, The		Christianity / Critique	Watts & Co	1934	Reference				H/115
102743	Powys, Llewelyn	Pathetic Fallacy: A Study of Christianity, The		Chrstianity / Critique		1934	Reference				
104684	Powys, Llewelyn	Rats in the Sacristy		Catholicism	Watts & Co	1937	Reference				H/218
103454	Poynter, J W	Hilaire Belloc Keeps the Bridge		Catholicism	Watts & Co	1929	Lending				P/59
102751	Poynter, J W	Hilaire Belloc Keeps the Bridge		Catholicism	Watts & Co	1929	Reference				P/59
100721	Poynter, J W	Popes and Social Problems, The		Catholicism / Politics	Watts & Co	1949	Lending	2			H/101
102750	Poynter, J W	Popes and Social Problems, The		Catholicism / Politics	Watts & Co	1949	Reference				H/101
101613	Prabhupada, A C B Swami	Bhagavad-Gita As It Is		Hinduism	Bhakdivedanta Book Trust	1994	Reference			$30.00	H/904
102589	Praag Van P	Foundations of Humanism		Humanism		1982	Lending				
106366	Praed, Winthrop Mackworth	The poems of Winthrop Mackworth Praed		Poetry	London	1886	Lending				
104357	Pratchett, Terry	Eric		Fiction	VGSF	1991	Lending				P/155
102780	Pratney, Winkie	Creation or Evolution?		Creationism / Apoogetics	Winkie Pratney	1985	Lending				P/31
102781	Pratt, James Bissett	Religious Consciousness, The: A Psychological Study		Psychology / Religion	MacMillan	1927	Reference				H/488
102782	Prescott, William	History of the Conquest of Peru, Vol 1		History / South America	Thomas Y. Crowle and Company	1847	Reference				H/397
	Pressat, Roland	Population		Sociology	Watts & Co.	1970	Reference				H/152
103455	Price, Barry	Creation Science Controversy, The		Creationism / Evolution	Millenium Books	1990	Lending	10	0-85574-889-3		P/244
101845	Price, Robert	Deconstructing Jesus		Jesus	Prometheus Books	2000	Lending	3	1-57392-758-9		H/284
102784	Pringle Peter & J Spigleman	Nuclear Barons The		Science / Nuclear		1982	Lending				
104352	Proctor, Richard A	Other Worlds Than Ours		Science	Longmans Green	1870	Reference				H/324
102785	Proctor, Richard A	Pleasant Ways in Science		Science	Longmans Green	1895	Reference				H/402
103456	Proctor, Robert N,	Nazi War on Cancer, The		History / Germany	Princeton University Press	1999	Lending		0-691-00196-0	$68.95	H/380
102787	Ptolemy, Copernicus, Kepler	Almagest, The; On the Revolutions of the Heavenly Spheres; Epitome of Copernican Astronomy; Harmonies of the World, The		Astronomy	Encyclopedia Brittanica	1952	Reference				H/1085
102790	Pulsford, Edward J	Rationalists Should be Christians!		Christian Apologetics	New Church Missionary Tract Society	1938	Reference				H/206
102791	Pun, Pattle P T	Evolution: Nature and Scripture in Conflict?		Creationism / Evolution	Zondervan Publishing House	1982	Lending				P/336
103430	Punch	Funny Peculiar: Punch on the Paranormal		Cartoons / Satire	Punch	1990	Lending		0-246-13646-4		P/
103457	Pusey E.B. 	Confessions of St Augustine The		Catholicism		1907	Reference				
104535	Pyke Magnus	There & Back	examines our love hate with technology	Science		1978	Lending				
104356	Pyke Magnus	Butter Side up the delights of science		Science		1976	Lending				
104355	Pyke Magnus	Our Future		Science		1980	Lending				
106649	Ali Yusaf Abduulah	The Meaning of the Holy Qur`an		Islamic religion	The editorial Board amana publications USA		Reference				
104358	Quammen David	Song of the DoDo The	island biography ,{ age of extinction }	History		1996	Lending				
104534	Rabelais, Francois	Gargantua & Pantagruel		Literature	Encyclopedia Brittanica	1952	Reference				H/318
102792	Rachels, James	Elements of Moral Philosophy, The		Philosophy / Ethics	McGraw Hill	1993	Lending		0-07-051098-9	$12.00	P/216
102793	Rachels, James	End of Life, The: Euthanasia and Morality		Euthanasia	Oxford University Press	1987	Lending	1	0-19-286070-4		P/204
106459	Radford Ken	Witchery & Sorcery Tales of		History /Witches		1989	Lending		1-85152-346-4		
103476	Rabin Jonathan	Holy War My	Dispatches from the front	History / Religion		2006	Lending				
104350	Radest, Howard B.	Devil and Secual Humanism, The: The Children of the Enlightenment		Humanism	Praeger Publishers	1990	Lending				H/170
103472	Raglan, Lord	Hero, The		Mythology	Watts & Co.	1949	Lending				H/310
102800	Raglan, Lord	Hero, The		Mythology	Watts & Co.	1949	Reference				H/310
102798	Raglan, Lord	Jocasta's Crime		Mythology / Ancient	Watts & Co.	1940	Lending				H/149
102797	Raglan, Lord	Jocasta's Crime		Mythology / Ancient	Watts & Co.	1940	Reference				H/149
102795	Raglan, Lord	Origins of Religion, The		Religion / Anthropology	Watts & Co.	1949	Lending	1			H/133
102796	Raglan, Lord	Origins of Religion, The		Religion / Anthropology	Watts & Co.	1949	Reference				H/132
102801	Ralph, Philip Lee	Story of Our Civilisation, The		Anthropology	Victor Gollancz	1955	Reference				H/319
104809	Ramsay William M	Letters to the seven Churches The	Seven letters of Asia minor, a basis for many series o f sermons, history: archaeology	Theology	Hodder & Stoughton, London	1963	Lending				
102804	Rand, Ayn	Anthem		Fiction	Dutton	1995	Lending	1	0-525-94015-4		H/253
103465	Rand, Ayn	Atlas Shrugged		Fiction	Signet	1992	Lending		0-451-19114-5	$21.95	P/1079
102638	Rand Ayn	Atlas Shrugged		Fiction	Signet	1957	Reference				
104465	Rand Ayn	Atlas Shrugged		Fiction	Signet	1957	Reference				
104367	Rand Ayn	Capitalism the Unknown Deal		Politics		1966	Lending				
104362	Rand Ayn	For the New Intelellectual				1961	Reference				
104366	Rand, Ayn	Fountainhead, The		Fiction	Cassell & Company Ltd	1947	Lending				H/644
103479	Rand Ayn	Fountainhead, The		Fiction		1961	Lending				
104368	Rand Ayn	New Left The		Politics		1970	Lending				
104361	Rand Ayn	Objectivist Epistemology Inrtoduction to		Objectivism		1966	Lending				
104360	Rand, Ayn	Philosophy: Why Needs It?		Philosophy	signet	1984	Lending		0-451-13893-7	$8.00	P/228
102754	Rand, Ayn	Virtue of Selfishness, The : A New Concept of Egoism		Philosophy	Signet	1961	Lending		0-451-16393-1		P/173
103478	Rand, Ayn	Virtue of Selfishness, The: A New Concept of Egoism		Philosophy	Signet	1964	Lending		0-451-12931-8		P/151
102805	Rand Ayn	Virtue of Selfishness, The : A New Concept of Egoism				1961	Reference				
104365	Rand Ayn	We the Living		Philosophy	Signet	1936	Lending				
104363	Randi, James	Faith Healers, The		Pseudomedicine	Prometheus Books	1987	Lending	5	0-87975-369-2		H/314
101160	Randi, James	Flim-Flam: Psychics, ESP, Unicorns and Other Delusions		Parapsychology	Prometheus Books	1986	Lending	4	0-87975-198-3	$9.90	P/342
102806	Randi, James	Mask of Nostradamus, The: A Biography of the World's Most Famous Prophet		Biography / Nostradamus	Charles Scribner's Sons	1990	Lending	6	0-684-19056-7		H/256
102807	Randi, James	Mask of Nostradamus, The: A Biography of the World's Most Famous Prophet		Biography / Nostradamus	Charles Scribner's Sons	1990	Reference		0-684-19056-7		H/256
101161	Randi, James	Supernatural A-Z, The: The Truth and the Lies		Superstition	Headline	1995	Lending	3	0-7472-4643-2		P/363
102808	Randi, James	Supernatural A-Z, The: The Truth and the Lies		Superstition	Headline	1995	Reference		0-7472-4643-2		P/363
102812	Ranin David	Double Cross	The code of the catholic church	Catholicism		2006	Lending				
104532	Ranke, Leopold von	History of the Popes During the Last Four Centuries, Vol I		Catholicism	George Bell and Sons, London	1913	Reference				H/548
102813	Ranke, Leopold von	History of the Popes During the Last Four Centuries, Vol II		Catholicism	George Bell and Sons	1913	Reference				H/572
102809	Ranke, Leopold von	History of the Popes, Their Church and State, in the 16th and 17th Centuries		Catholicism	Whittaker	1843	Reference				H/540
106470	Ranston Harry	Ecclesiastes and the Early Greek Wisdom Literature 		Theology	Camelot Press Limited Britain	1925	Lending				
102816	Rappoport, Angelo	Love Affairs of The Vatican, The		Catholicism	Barters Handbooks	1912	Reference				H/256
102434	Raso, Jack	Mystical Diets: Paranormal, Spiritual, and occult Nutrition Practices		Nutrition / Diet	Prometheus Books	1993	Lending		0-87975-761-2	$15.00	H/291
102817	Ratcliffe, S K	Story of South Place, The		Rationalism / History	Watts & Co.	1955	Lending				H/84
102818	Ratcliffe, S K	Story of South Place, The		Rationalism / History	Watts & Co.	1955	Reference				H/84
102819	Rationalist Association	Heavenly Humour		Humour		1958	Lending				
104747	Rationalist Miscellany	Rationalist Miscellany		Rationalism	Asstd. Publishers	1925	Reference				H/
102820	Rationalist Miscellany	Rationalist Miscellany 2		Rationalism	Asstd. Publishers	1925	Reference				H/
102821	Rationalist Miscellany	Rationalist Miscellany 3		Rationalism	Asstd. Publishers	1925	Reference				H/
102822	Rationalist Miscellany	Rationalist Miscellany 4		Rationalism	Asstd. Publishers	1925	Reference				H/
102823	Rationalist Miscellany	Rationalist Miscellany 5		Rationalism	Asstd. Publishers	1925	Reference				H/
102824	Rationalist Miscellany	Rationalist Miscellany 6		Rationalism	Asstd. Publishers	1925	Reference				H/
102825	Rationalist Miscellany	Rationalist Miscellany 7		Rationalism	Asstd. Publishers	1925	Reference				H/
102826	Rationalist Miscellany	Rationalist Miscellany 8		Rationalism	Asstd. Publishers	1925	Reference				H/
103480	Rationalist Press Association	World Union of Freethinkers:  International Conference	Freethinkers conference	Rationalism	Asstd. Publishers	1938	Reference				
102571	Rationalist Press Association	World Union of Freethinkers:  International Conference	Freethinkers conference	Rationalism	Asstd. Publishers	1938	Reference				
104485	Rationalist Press Association	World Union of Freethinkers:  International Conference	Freethinkers conference	Rationalism	Asstd. Publishers	1938	Reference				
104871	Rauschning Hermann	Hitler Speaks: A series of Political Conversations with Adolf Hitler On his Real Aims		Politics	Thornton ButterWorth Ltd	1939	Lending				
106234	Rawlinson, George	Ancient History: The Great Civilization from 3000 B.C. To the Fall of Rome		Ancient History	Barnes & Noble Books	1993	Lending		1-56619-317-6		
102570	Read W. F	Egyptian Religion & Ethics		History /Religion / Ethics		1925	Reference				
104373	Reade, Winwood	Martyrdom of Man, The		History	Watts & Co.	1924	Lending				H/455
102829	Reade, Winwood	Martyrdom of Man, The		History	The Truth Seeker Company	1910	Reference				H/563
102828	Reade, Winwood	Martyrdom of Man, The		History	Watts & Co.	1910	Reference				H/543
102831	Reade, Winwood	Martyrdom of Man, The		History	Watts & Co	1924	Lending				
104374	Reade, Winwood	Outcast, The		Fiction	Watts & Co.	1933	Lending				H/119
102832	Reade, Winwood	Outcast, The		Fiction	Watts & Co.	1933	Reference				H/119
106206	Reardon Bernard M. G.	Religious Thought in the Nineteenth Century		Theology	Cambridge University Press	1966	Lending				
104828	Reardon Bernard M. G.	Coleridge to Gore From	A Century of Religious Thought in Britain	Theology	longman Group Lmtd	1971	Lending		0582-48510.x		
104991	Redinger, Ruby V.	George Eliot: The emergent self		Biography  	The Bodley Head	1975	Lending		0-370-10458-7		
106218	Redwood John	Reason, ridicule and religion: The Age of enlightenment in England 1660-1750		History	Thames and Hudson	1996	Lending		0-500-27885-7		
104911	Rees, Martin	A Scientific warning: How terror, error and environmental disaster threaten humankind's future in this century-on earth and beyond		Science/Technology/humanism	Basic books	2004	Lending		0-465-0682-6		
103481	Rees Bob	Clerical Errors	God religion & Power	Religion	Glasnevin Publishing Dublin	2012	Lending		976-978-390868		
106205	Rees, Nigel	Bloomsbury dictionary of Popular phrases		Language 	Bloomsbury	1990	Lending		0-7475-0344-3		
104931	Reese, W. L.	Dictionary of Philosophy and Religion Eastern and Western thought		Philosophy	Humanities Press	1980	Reference		0-85527-147-7		
104764	Reid, W Nicol	Supremacy of Reason, The		Rationalism	Watts & Co.	1924	Lending	1			H/124
102833	Reid, W Nicol	Supremacy of Reason, The		Rationalism	Watts & Co.	1924	Reference				H/124
102836	Religions	Religions of the World The	by members of each denomination	Religion	Charles Griffin & Co	1879	Reference				
104613	Relethford John	There & Back		Anthropology		1997	Lending				
104375	Renfrew Colin	Before Civilization		History		1973	Lending				
104888	Renan, Ernest	Life of Jesus 		Jesus	Little, Brown & Co.	1903	Lending				
104370	Renan, Ernest	History of the Origins of Christianity, Book II: The Apostles		Biblical Studies	Mathieson & Co.	1890	Reference				H/292
102840	Renan, Ernest	History of the Origins of Christianity, Book IV: The Anti-Christ		Biblical Studies	Mathieson & Co.	1890	Reference				H/206
